标题,摘要,发布时间,链接
反对马斯克万亿美元薪酬方案 工会与机构发起“夺回特斯拉”行动,【反对马斯克万亿美元薪酬方案 工会与机构发起“夺回特斯拉”行动】据报道，在特斯拉季度财报公布的前一天，一个由工会与企业监督组织组成的联盟呼吁投资者关注公司治理问题。该联盟周二上线名为“夺回特斯拉”（TakeBackTesla）的活动网站，号召股东投票反对CEO马斯克近1万亿美元的薪酬方案，称这将进一步扩大马斯克对公司的控制权。联盟批评这一超大薪酬方案“极其离谱”，部分原因是马斯克的政治活动“损害了特斯拉品牌并分散了他对公司领导工作的注意力”。,2025-10-22 07:13:28,https://finance.eastmoney.com/a/202510223540332245.html
泽连斯基：已准备好通过外交手段结束乌克兰危机,【泽连斯基：已准备好通过外交手段结束乌克兰危机】据乌克兰新闻通讯社当地时间21日报道，乌克兰总统泽连斯基表示，乌克兰已与伙伴国就通过外交手段结束乌克兰危机达成统一立场，并准备进行相应对话。,2025-10-22 07:08:48,https://finance.eastmoney.com/a/202510223540330295.html
国保动物作原料！病原微生物诊断龙头今日申购 另有一只新股上市丨打新早知道,【国保动物作原料！病原微生物诊断龙头今日申购 另有一只新股上市】10月22日，可申购北交所上市的丹娜生物（920009.BJ）；另有一只新股上市，为深市主板的马可波罗（001386.SZ）。,2025-10-22 07:08:15,https://finance.eastmoney.com/a/202510223540328482.html
跳水！国际金价一度暴跌6% 创2013年以来最大单日跌幅,【跳水！国际金价一度暴跌6% 创2013年以来最大单日跌幅】市场普遍认为，这轮剧烈调整反映了前期涨势过快后的自然回调。随着金价在高位交投、市场多头仓位集中，情绪变化被迅速放大。部分分析人士认为，这一轮下跌更多是技术性调整，而非趋势性逆转。汇丰贵金属策略师詹姆斯·斯蒂尔（James Steel）对第一财经记者表示，近期金价涨势“近乎抛物线式”，高杠杆与集中持仓使市场对外部情绪的敏感度上升。在他看来，黄金中期上升趋势仍在延续。,2025-10-22 07:07:54,https://finance.eastmoney.com/a/202510223540328035.html
美股涨跌互现 道指新高涨逾200点 奈飞放榜盘后下跌超6%,【美股涨跌互现 道指新高涨逾200点 奈飞放榜盘后下跌超6%】美国股市周二收盘涨跌不一，道琼斯工业平均指数创历史新高，受蓝筹股财报提振。标普500指数收盘基本持平，而科技与半导体板块走软，令纳斯达克指数小幅下滑。盘后，流媒体巨头奈飞（Netflix）公布财报后股价下跌超6%。公司第三季度每股收益为5.87美元，低于市场预期的6.97美元；营收115.1亿美元，与分析师预期基本一致。,2025-10-22 07:07:53,https://finance.eastmoney.com/a/202510223540327869.html
10月以来获融资资金净买入居前的低估值业绩连增股一览,【10月以来获融资资金净买入居前的低估值业绩连增股一览】据数据宝统计，截至10月21日，在已正式发布三季报的140多只个股中，有70余只个股第三季度净利润环比增长，占比过半。其中，第二季度实现盈利且第三季度净利润环比增幅超50%的个股有21只，光莆股份、海通发展、翔丰华、美芯晟等8只个股环比增幅超100%。,2025-10-22 07:07:44,https://finance.eastmoney.com/a/202510223540328133.html
财说 | 同有科技业绩暴增300% 高毛利神话能否延续？,【财说 | 同有科技业绩暴增300% 高毛利神话能否延续？】同有科技（300302.SZ）呈现显著业绩反转。前三季度，公司归母净利润实现扭亏为盈。其中，第三季度单季营业收入同比暴增197.06%，净利润飙升300.46%，得益于高端新品推广“成效显著”，利润端大幅改善，毛利率持续提升至52.34%。,2025-10-22 07:07:00,https://finance.eastmoney.com/a/202510223540327492.html
韩国财政部：将自11月起削减燃油税减免措施,韩国财政部称，将自11月起削减燃油税减免措施。,2025-10-22 07:06:49,https://finance.eastmoney.com/a/202510223540327172.html
周三（10月22日）重点关注财经事件和经济数据,【周三（10月22日）重点关注财经事件和经济数据】①14:00 英国9月CPI月率、9月零售物价指数月率；②20:25 欧洲央行行长拉加德发表讲话；③22:30 美国至10月17日当周EIA原油库存、EIA战略石油储备库存等。,2025-10-22 07:00:45,https://finance.eastmoney.com/a/202510223540325710.html
酒店海景房把“清晰看军港”当卖点泄密被查，国安部：莫为“商业利益”忘了“国家安全”,【个别商家涉嫌在广告宣传中发布敏感单位涉密信息 国安部：莫为“商业利益”忘了“国家安全”】国家安全部微信公众号发文，在流量为王的当下，个别商家、博主为了吸引眼球，不惜在广告和短视频中嵌入敏感场所和内容来博取关注、扩大影响。殊不知，此类行为已经触碰国家安全红线，埋下失泄密隐患。近期，国家安全机关发现并查处多起违规商业广告行为，个别商家涉嫌在广告宣传中发布敏感单位涉密信息，给国家安全造成潜在危害。,2025-10-22 06:59:59,https://finance.eastmoney.com/a/202510223540326029.html
中国援赞比亚粮食援助项目交接仪式在卢萨卡举行,【中国援赞比亚粮食援助项目交接仪式在卢萨卡举行】当地时间10月20日，中国政府与联合国世界粮食计划署合作向赞比亚提供350万美元粮食援助项目交接仪式在卢萨卡举行。韩镜大使陪同赞副总统纳卢曼戈出席。联合国世界粮食计划署驻赞代表卡巴苏加、赞土地部部长马塞博、减灾署国家协调员奇帕库帕库、中国国际经济技术交流中心副主任李抒音等参加。,2025-10-22 06:58:11,https://finance.eastmoney.com/a/202510223540325018.html
宇树科技IPO最新进展,【宇树科技IPO最新进展】10月21日，中国证监会官网披露了宇树科技上市辅导工作进展情况报告（第一期）。回溯来看，今年7月，宇树科技在浙江证监局办理辅导备案，并披露了首次公开发行股票并上市辅导备案报告。辅导机构为中信证券，律师事务所为北京德恒律师事务所，会计师事务所为容诚会计师事务所。,2025-10-22 06:57:04,https://finance.eastmoney.com/a/202510223540324916.html
国际油价或步入下行周期 化工行业板块分化明显,【国际油价或步入下行周期 化工行业板块分化明显】展望四季度，国际原油与化工行业的运行轨迹逐渐清晰。上海证券报记者采访多位专家获悉，受OPEC+（产油国联盟）持续增产、原油消费旺季结束等因素影响，四季度油价或维持震荡偏弱态势。,2025-10-22 06:50:06,https://finance.eastmoney.com/a/202510223540299874.html
OpenAI推出AI浏览器！谷歌股价一度跌超4%,【OpenAI推出AI浏览器！谷歌股价一度跌超4%】当地时间10月21日，人工智能（AI）研究公司OpenAI发布了一款由AI驱动的新型网页浏览器——ChatGPTAtlas，与谷歌的Chrome浏览器展开直接竞争。受此消息影响，谷歌当地时间10月21日美股盘中一度大跌超4%。,2025-10-22 06:45:23,https://finance.eastmoney.com/a/202510223540323376.html
老铺黄金拟折价4.5%配售371万股H股,"【老铺黄金拟折价4.5%配售371万股H股】老铺黄金(06181.HK)在港交所公告，于2025年10月21日（联交所交易时段后），公司与配售代理订立配售协议，据此，配售代理已有条件及单独同意作为本公司代理尽力促使合共不少于六名承配人按照配售协议所载条款并在其条件规限下购买3,711,800股新H股，配售价为每股H股732.49港元（较最新收盘价折价4.5%）。",2025-10-22 06:39:53,https://finance.eastmoney.com/a/202510223540323266.html
周三你需要知道的隔夜全球要闻,【周三你需要知道的隔夜全球要闻】1、美国总统特朗普称尚未就与普京的会晤做出决定。特朗普还表示，他仍然认为乌克兰与俄罗斯有机会停火。2、美政府停摆三周，但两党仍暂无新一轮谈判计划。3、美国据悉将采购100万桶原油作为战略石油储备。,2025-10-22 06:30:22,https://finance.eastmoney.com/a/202510223540322611.html
欧盟同意逐步停止从俄罗斯进口天然气,【欧盟同意逐步停止从俄罗斯进口天然气】欧盟理事会20日表示，欧盟成员国支持在2028年1月前逐步停止进口俄罗斯天然气的提案。当天在卢森堡举行的欧盟理事会会议上，欧盟能源部长们批准了相关提案。自2026年1月1日起，欧盟禁止内部各方与俄罗斯签订新的进口天然气合同；同时为现有合同保留过渡期，短期合同可持续至2026年6月17日，长期合同将在2028年1月1日前终止。该提案还需要经欧洲议会批准。,2025-10-22 06:26:41,https://finance.eastmoney.com/a/202510223540313444.html
公募基金加速上新 正向循环逐步形成,【公募基金加速上新 正向循环逐步形成】近期基金发行升温，无论新发产品数量还是募集份额均有所提升，与此同时，认购期限大幅缩短。新基金发行盛宴既是市场情绪回暖的见证，也为权益市场持续走强提供了增量资金支撑，形成了“发行热、资金进、市场强”的正向循环。,2025-10-22 06:18:10,https://finance.eastmoney.com/a/202510223540321260.html
扩内需增活力优环境 “十四五”深化改革结硕果,【扩内需增活力优环境 “十四五”深化改革结硕果】“十四五”以来，依托强大的国内市场，内需始终是中国经济发展的主动力和稳定锚；一系列改革举措落地显效，让经营主体信心增强、轻装上阵；全国统一大市场建设加快推进，市场环境持续优化，要素资源更高效配置。展望“十五五”时期，多位专家认为，应继续聚焦经济运行深层次的矛盾和问题，推动各项标志性改革举措落地见效。,2025-10-22 06:18:00,https://finance.eastmoney.com/a/202510223540321146.html
大额股权转让频现背后：金租头部公司筑护城河 中小机构承压求变,【大额股权转让频现背后：金租头部公司筑护城河 中小机构承压求变】近日，多家金租公司大额股权转让频现，不少股权转让起拍价超亿元，但整体来看，金租公司股权转让成交并不活跃。与此同时，金租行业分化加剧，头部公司凭借资本和资源优势构筑起深厚的护城河，而中小公司在业务转型和市场竞争中面临较大压力。,2025-10-22 06:17:56,https://finance.eastmoney.com/a/202510223540321360.html
港股市场迎来修复 短期震荡不改长期上行趋势,【港股市场迎来修复 短期震荡不改长期上行趋势】10月以来，港股市场持续震荡调整，恒生指数一度从27000点下探至近25000点。10月21日，市场迎来回暖，三大指数高开高走，工业、非银金融等板块表现强势。值得注意的是，虽然本月市场持续调整，但南向资金仍保持净流入。业内人士表示，南向增量资金尚处于持续入市进程中，有望继续发挥支撑作用，港股短期波动未改长期上行趋势。,2025-10-22 06:17:31,https://finance.eastmoney.com/a/202510223540320718.html
金油比逼近历史高位 机构认为强金价弱油价长期或难扭转,【金油比逼近历史高位 机构认为强金价弱油价长期或难扭转】近期，国际黄金与原油市场呈现鲜明分化态势，金价一路高歌猛进，纽约商品交易所（COMEX）黄金期货价格一度飙升至4300美元/盎司上方，迭创历史新高；油价却持续承压，美国WTI原油期货价格最低下破56美元/桶一线，创下今年5月初以来的新低，金油比随之显著攀升。,2025-10-22 06:17:25,https://finance.eastmoney.com/a/202510223540321544.html
白银交易热度居高不下 资金涌入背后波动风险隐现,【白银交易热度居高不下 资金涌入背后波动风险隐现】在近期触及历史新高后，伦敦银现货价格震荡加剧。10月21日午后，伦敦银现货价格短线跳水，跌破50美元/盎司。今年以来，截至10月21日，银价累计涨幅约70%，重回历史高位，这让部分投资者选择止盈离场，但也吸引更多人在赚钱效应下追高买入。业内人士认为，当前银价短期下行风险逐渐累积，即使是投资资金短期回流，也可能引发价格大幅回调。对于普通投资者而言，应根据自身风险承受能力理性配置。,2025-10-22 06:17:10,https://finance.eastmoney.com/a/202510223540321774.html
美联储10月降息25个基点的概率为98.9%,【美联储10月降息25个基点的概率为98.9%】据CME“美联储观察”：美联储10月降息25个基点的概率为98.9%，维持利率不变的概率为1.1%。美联储12月累计降息50个基点的概率为98.7%，累计降息75个基点的概率为0.2%。,2025-10-22 06:12:10,https://finance.eastmoney.com/a/202510223540320396.html
富时A50期指连续夜盘收跌0.25% 报15193点,富时A50期指连续夜盘收跌0.25%，报15193点。,2025-10-22 05:51:57,https://finance.eastmoney.com/a/202510223540316919.html
欧债收益率集体下跌 英国10年期国债收益率跌2.7个基点,【欧债收益率集体下跌 英国10年期国债收益率跌2.7个基点】当地时间10月21日，欧债收益率集体下跌，英国10年期国债收益率跌2.7个基点报4.476%，法国10年期国债收益率跌2个基点报3.341%，德国10年期国债收益率跌2.5报2.550%，意大利10年期国债收益率跌2.2个基点报3.342%，西班牙10年期国债收益率跌2.2个基点报3.079%。,2025-10-22 05:49:59,https://finance.eastmoney.com/a/202510223540314638.html
淡水河谷第三季度铁矿石产量9440万吨 市场预估9123万吨,淡水河谷第三季度铁矿石产量9440万吨，市场预估9123万吨；镍产量4.68万吨，市场预估4.19万吨。,2025-10-22 05:48:04,https://finance.eastmoney.com/a/202510223540319795.html
据报道：Anthropic拟与谷歌云达成数百亿美元合作协议,据报道，Anthropic拟与谷歌云达成数百亿美元合作协议。,2025-10-22 05:46:58,https://finance.eastmoney.com/a/202510223540319616.html
据报道：空客、泰雷兹与莱昂纳多公司即将就合并航天业务达成协议,据报道，空客、泰雷兹（Thales）与莱昂纳多公司（Leonardo SpA）即将就合并航天业务达成协议。,2025-10-22 05:24:18,https://finance.eastmoney.com/a/202510223540307947.html
路威酩轩集团正考虑出售其在Fenty Beauty品牌中持有的50%股份,路威酩轩集团（LVMH）正考虑出售其在Fenty Beauty品牌中持有的50%股份。,2025-10-22 05:20:09,https://finance.eastmoney.com/a/202510223540307517.html
特朗普称尚未就与普京的会晤做出决定,【特朗普称尚未就与普京的会晤做出决定】当地时间21日，美国总统特朗普称尚未就与普京的会晤做出决定。特朗普还表示，他仍然认为乌克兰与俄罗斯有机会停火。,2025-10-22 05:18:14,https://finance.eastmoney.com/a/202510223540307451.html
离岸人民币兑美元较周一纽约尾盘跌27点,【离岸人民币兑美元较周一纽约尾盘跌27点】周二（10月21日）纽约尾盘（周三北京时间04:59），离岸人民币（CNH）兑美元报7.1268元，较周一纽约尾盘跌27点，日内整体交投于7.1162-7.1271元区间。,2025-10-22 05:16:51,https://finance.eastmoney.com/a/202510223540307391.html
国际金银大幅收跌 黄金盘中一度创自2013年4月以来的最大单日跌幅,【国际金银大幅收跌 黄金盘中一度创自2013年4月以来的最大单日跌幅】COMEX黄金期货跌5.07%，报4138.5美元/盎司；现货黄金跌5.18%，报4130.41美元/盎司，盘中一度创自2013年4月以来的最大单日跌幅。COMEX白银期货跌6.27%，报48.16美元/盎司；现货白银跌7.16%，报48.705美元/盎司，盘中一度创下自2021年以来的最大跌幅。,2025-10-22 05:02:50,https://finance.eastmoney.com/a/202510223540306590.html
韩国9月PPI环比增长0.4% 同比增长1.2%,韩国9月PPI环比增长0.4%，同比增长1.2%。,2025-10-22 05:02:18,https://finance.eastmoney.com/a/202510223540306646.html
美光科技CEO表示：将投资2000亿美元用于在美国的存储器制造,美光科技CEO表示，将投资2000亿美元用于在美国的存储器制造。,2025-10-22 05:00:00,https://finance.eastmoney.com/a/202510223540307229.html
奈飞联席首席执行官表示：第三季度实现史上最佳广告销售额,奈飞联席首席执行官表示，第三季度实现史上最佳广告销售额，今年广告收入有望实现逾倍增长。,2025-10-22 04:52:08,https://finance.eastmoney.com/a/202510223540307062.html
美国总统特朗普重申 美联储政策利率太高,美国总统特朗普重申，美联储政策利率太高。,2025-10-22 04:43:11,https://finance.eastmoney.com/a/202510223540306753.html
美国至10月17日当周API原油库存减少298.1万桶,美国至10月17日当周API原油库存减少298.1万桶。,2025-10-22 04:36:57,https://finance.eastmoney.com/a/202510223540306216.html
微软CEO年薪接近1亿美元,【微软CEO年薪接近1亿美元】美国证监会文件显示，微软董事长兼首席执行官萨提亚·纳德拉2025年度总薪酬为9650万美元，其中包含8420万美元股权奖励。,2025-10-22 04:34:20,https://finance.eastmoney.com/a/202510223540306154.html
美泰三季度每股收益0.89美元 不及市场预期,【美泰三季度每股收益0.89美元 不及市场预期】美泰第三季度调整毛利率50.2%，市场预计51%；三季度净销售额17.4亿美元，市场预计18.4亿美元；三季度调整后每股收益0.89美元，市场预计1.06美元。美泰仍预计财年调整后每股收益在1.54美元至1.66美元之间，市场预计1.61美元。,2025-10-22 04:24:25,https://finance.eastmoney.com/a/202510223540306027.html
通用电气维尔萨同意以53亿美元收购墨西哥电力设备制造商PROLEC剩余50%股权,通用电气维尔萨（GE VERNOVA）同意以53亿美元收购墨西哥电力设备制造商PROLEC剩余50%股权。,2025-10-22 04:17:15,https://finance.eastmoney.com/a/202510223540305947.html
德州仪器美股盘后跌超5%,【德州仪器美股盘后跌超5%】德州仪器美股盘后跌超5%。公司三季度每股收益1.48美元，市场预估1.9美元。,2025-10-22 04:13:24,https://finance.eastmoney.com/a/202510223540305748.html
德州仪器预计第四季度营收为42.2亿至45.8亿美元 市场预估为45亿美元,德州仪器预计第四季度营收为42.2亿至45.8亿美元，市场预估为45亿美元。,2025-10-22 04:04:59,https://finance.eastmoney.com/a/202510223540303919.html
奈飞美股盘后跌超7%,奈飞美股盘后跌超7%。,2025-10-22 04:04:23,https://finance.eastmoney.com/a/202510223540303883.html
奈飞第三季度营收达115.1亿美元 同比增长17.2%,【奈飞第三季度营收达115.1亿美元 同比增长17.2%】奈飞第三季度营收达115.1亿美元，同比增长17.2%；预计第四季度营收为119.6亿美元；第三季度净利润为25.47亿美元，去年同期为23.64亿美元；第三季度每股收益5.87美元。公司预计全年营收451亿美元，公司原本预计448亿-452亿美元。,2025-10-22 04:03:38,https://finance.eastmoney.com/a/202510223540303677.html
纳斯达克中国金龙指数收跌0.97% 热门中概股多数下跌,纳斯达克中国金龙指数收跌0.97%，热门中概股多数下跌。阿里巴巴跌近4%，京东、名创优品跌近3%；哔哩哔哩逆势涨近6%。,2025-10-22 04:02:51,https://finance.eastmoney.com/a/202510223540303576.html
美股三大指数收盘涨跌不一 道指再创历史新高,【美股三大指数收盘涨跌不一 道指再创历史新高】美股三大指数收盘涨跌不一，道指涨0.47%，标普500指数平收，纳指跌0.16%。其中，道指再创历史新高。,2025-10-22 04:01:55,https://finance.eastmoney.com/a/202510223540303428.html
据报道：贝莱德携手太平洋投资管理公司共同参与Meta数据中心270亿美元融资项目,据报道，贝莱德携手太平洋投资管理公司共同参与Meta数据中心270亿美元融资项目。,2025-10-22 03:51:14,https://finance.eastmoney.com/a/202510223540303289.html
英国央行货币政策委员曼恩称：英国通胀预期已偏离2%的目标,英国央行货币政策委员曼恩称，英国通胀预期已偏离2%的目标。,2025-10-22 03:45:25,https://finance.eastmoney.com/a/202510223540303169.html
世卫组织：苏丹登革热疫情严峻 超3.7万人感染,【世卫组织：苏丹登革热疫情严峻 超3.7万人感染】当地时间10月21日，世界卫生组织表示，苏丹登革热疫情严峻，目前已有超过3.7万人被感染，造成100多人死亡。,2025-10-22 03:33:39,https://finance.eastmoney.com/a/202510223540303367.html
在岸人民币兑美元较周一夜盘收盘跌20点,【在岸人民币兑美元较周一夜盘收盘跌20点】在岸人民币兑美元（CNY）北京时间03:00收报7.1250元，较周一夜盘收盘跌20点。成交量405.58亿美元。,2025-10-22 03:21:58,https://finance.eastmoney.com/a/202510223540302948.html
阿根廷比索在非正式平行市场汇率下跌2.6% 跌至历史最低水平,"阿根廷比索在非正式平行市场汇率下跌2.6%，跌至历史最低水平，报每美元兑1,545比索。",2025-10-22 03:05:51,https://finance.eastmoney.com/a/202510223540302831.html
华纳兄弟探索公司上涨11% 此前董事会拒绝了派拉蒙-Skydance的收购提议,华纳兄弟探索公司(WBD.O)上涨11%，此前董事会拒绝了派拉蒙-Skydance的收购提议。,2025-10-22 03:01:56,https://finance.eastmoney.com/a/202510223540302628.html
据报道：华纳兄弟探索公司董事会已拒绝派拉蒙提出的每股23至24美元现金收购报价,据报道，华纳兄弟探索公司董事会已拒绝派拉蒙提出的每股23至24美元现金收购报价。,2025-10-22 02:46:47,https://finance.eastmoney.com/a/202510223540302539.html
苹果因遇到阻碍推迟了巨型折叠iPad的计划,【苹果因遇到阻碍推迟了巨型折叠iPad的计划】苹果因遇到阻碍推迟了巨型折叠iPad的计划。苹果的可折叠iPad本预计将于2028年上市，目前预计上市时间推迟到2029年或更晚。苹果正与三星显示合作，为iPad开发18英寸面板。,2025-10-22 02:33:01,https://finance.eastmoney.com/a/202510223540302262.html
美油、布油小幅收涨,【美油、布油小幅收涨】WTI原油期货收涨0.52%，报57.82美元/桶。布伦特原油期货收涨0.51%，报61.32美元/桶。,2025-10-22 02:32:52,https://finance.eastmoney.com/a/202510223540302327.html
沪金主力合约夜盘收跌4.64% 报945元/克,【沪金主力合约夜盘收跌4.64% 报945元/克】沪金主力合约夜盘收跌4.64%，报945元/克，沪银主力合约收跌4.86%，报11285元/千克，SC原油主力合约收涨0.64%，报439元/桶。,2025-10-22 02:32:47,https://finance.eastmoney.com/a/202510223540302440.html
巴西矿业协会副主席表示 预计到2029年巴西将吸引关键矿产投资184.5亿美元,巴西矿业协会副主席表示，预计到2029年巴西将吸引关键矿产投资184.5亿美元。,2025-10-22 02:21:39,https://finance.eastmoney.com/a/202510223540301557.html
乌克兰总统与西班牙首相通话 讨论能源援助与防务合作,【乌克兰总统与西班牙首相通话 讨论能源援助与防务合作】当地时间21日，乌克兰总统泽连斯基表示，他当天与西班牙首相桑切斯通话，双方重点讨论了能源援助和加强乌克兰防务等问题。,2025-10-22 02:14:58,https://finance.eastmoney.com/a/202510223540300710.html
巴西矿业协会数据显示 巴西矿业部门第三季度出口总量达1.21亿吨,巴西矿业协会数据显示，巴西矿业部门第三季度出口总量达1.21亿吨，较去年同期增长6.2%。巴西铁矿石第三季度出口总量达1.175亿吨，较去年同期增长6.5%。,2025-10-22 02:14:24,https://finance.eastmoney.com/a/202510223540300460.html
存储芯片“超级周期”来临 涨价潮预计延续至2026年,【存储芯片“超级周期”来临 涨价潮预计延续至2026年】伴随着存储芯片市场的涨价潮，A股存储芯片相关公司的盈利预期改善、股价一路高涨，存储芯片“超级周期”来临。业内人士认为，这轮“超级周期”由AI驱动，数据中心大容量存储需求高速增长，叠加智能手机、智能汽车等智能终端渗透率提升，共同推动本轮存储技术创新与市场扩容。展望后市，分析人士预计AI服务器存储产品的涨价潮或延续至2026年。,2025-10-22 02:12:29,https://finance.eastmoney.com/a/202510223540300856.html
锂电材料供需逆转 六氟磷酸锂价格跳涨 磷酸铁锂产能利用率进入繁荣区间,【锂电材料供需逆转 六氟磷酸锂价格跳涨 磷酸铁锂产能利用率进入繁荣区间】日前，锂电市场旺盛的需求向上游传导，主要原材料六氟磷酸锂价格大涨，磷酸铁锂产能利用率攀升。据上海证券报记者统计，9月15日以来，六氟磷酸锂价格已上涨44%，尤其是最近十天左右跳涨33%。光大证券研究所研报分析，涨价的核心驱动因素是强劲的需求复苏与供给端的紧张格局。,2025-10-22 02:12:20,https://finance.eastmoney.com/a/202510223540301186.html
