标题,内容,发布日期,发布时间
上海前三季度GDP40721.17亿元 同比增长5.5%,【上海前三季度GDP40721.17亿元 同比增长5.5%】财联社10月22日电，上海市统计局发布数据显示，根据地区生产总值统一核算结果，前三季度全市实现地区生产总值40721.17亿元，按不变价格计算，同比增长5.5%。分产业看，第一产业增加值64.26亿元，增长0.9%；第二产业增加值8448.67亿元，增长3.9%；第三产业增加值32208.24亿元，增长5.9%。,2025-10-22,09:17:47
上海前三季度三大先导产业制造业产值同比增长8.5% 其中人工智能制造业增长12.8%,"【上海前三季度三大先导产业制造业产值同比增长8.5% 其中人工智能制造业增长12.8%】财联社10月22日电，上海市统计局发布数据显示，前三季度，全市工业增加值同比增长5.2%。全市规模以上工业总产值同比增长5.7%，增速比上半年提高0.1个百分点。从行业产值完成情况看，铁路、船舶、航空航天和其他运输设备制造业同比增长15.9%，电气机械和器材制造业增长14.3%，计算机、通信和其他电子设备制造业增长12.1%。

前三季度，三大先导产业制造业产值同比增长8.5%，增速快于全市规模以上工业总产值2.8个百分点。其中，人工智能制造业增长12.8%，集成电路制造业增长11.3%，生物医药制造业增长3.6%。前三季度，工业战略性新兴产业制造业总产值同比增长7.3%。其中，新能源产业增长19.6%，新一代信息技术产业增长10.9%，高端装备产业增长10.3%。",2025-10-22,09:20:01
央行公开市场今日净投放947亿元,【央行公开市场今日净投放947亿元】财联社10月22日电，央行今日开展1382亿元7天逆回购操作，操作利率为1.40%，与此前持平。因今日有435亿元7天期逆回购到期，当日实现净投放947亿元。,2025-10-22,09:21:19
上海前三季度第三产业增加值同比增长5.9%,【上海前三季度第三产业增加值同比增长5.9%】财联社10月22日电，上海市统计局发布数据显示，前三季度，全市第三产业增加值同比增长5.9%。其中，信息传输、软件和信息技术服务业增加值5277.43亿元，同比增长15.5%；金融业增加值6965.27亿元，增长9.8%；交通运输、仓储和邮政业增加值1476.75亿元，增长5.2%；租赁和商务服务业增加值3274.66亿元，增长3.2%。,2025-10-22,09:21:22
,财联社10月22日电，香港恒生指数开盘跌0.5%，恒生科技指数跌0.82%，泡泡玛特涨超7%，百度集团、阿里巴巴、理想汽车、快手跌超1%。,2025-10-22,09:21:49
上海前三季度工业投资增长20.3% 快于全市固定资产投资增速14.3个百分点,【上海前三季度工业投资增长20.3% 快于全市固定资产投资增速14.3个百分点】财联社10月22日电，上海市统计局发布数据显示，前三季度，全市固定资产投资同比增长6.0%。分领域看，工业投资增长20.3%，快于全市固定资产投资增速14.3个百分点；城市基础设施投资增长11.7%；房地产开发投资增长2.2%。新建商品房销售面积1202.42万平方米，同比下降0.3%。,2025-10-22,09:22:18
上海前三季度主要金融市场成交额同比增长12.7% 其中上交所有价证券成交额增长38.4%,【上海前三季度主要金融市场成交额同比增长12.7% 其中上交所有价证券成交额增长38.4%】财联社10月22日电，上海市统计局发布数据显示，前三季度，全市主要金融市场成交额同比增长12.7%。其中，上海证券交易所有价证券成交额增长38.4%，上海期货交易所成交额增长11.5%，上海黄金交易所成交额增长40.2%。9月末，全市中外资金融机构本外币存款余额23.84万亿元，同比增长8.4%；贷款余额12.89万亿元，增长7.1%。前三季度，全市地方一般公共预算收入6555.68亿元，同比增长1.0%；地方一般公共预算支出6876.39亿元，增长8.0%。,2025-10-22,09:23:44
【盘中宝】最高金额超100亿美元，行业内又一公司达成全球战略合作，机构称行业景气度可持续，“创新+国际化”产业趋势不变，这家企业公布新产品数据,最高金额超100亿美元，行业内又一公司达成全球战略合作，机构称行业景气度可持续，“创新+国际化”产业趋势不变，预计三季度相关板块将延续收入高增趋势，这家企业公布新产品数据，另一企业为全球相关公司提供服务。,2025-10-22,09:24:01
上海前三季度社会消费品零售总额同比增长4.3% 增速比上半年提高2.6个百分点,【上海前三季度社会消费品零售总额同比增长4.3% 增速比上半年提高2.6个百分点】财联社10月22日电，上海市统计局发布数据显示，前三季度，全市社会消费品零售总额12302.77亿元，同比增长4.3%，增速比上半年提高2.6个百分点。消费品以旧换新政策持续显效。从类别看，限额以上单位中，体育和娱乐用品类、家具类、家用电器和音像器材类零售额同比分别增长27.7%、22.1%、28.2%。,2025-10-22,09:25:42
港股黄金股集体走低 紫金黄金国际跌近7%,【港股黄金股集体走低 紫金黄金国际跌近7%】财联社10月22日电，截至发稿，紫金黄金国际(02259.HK)跌6.65%、山东黄金(01787.HK)跌6.43%、灵宝黄金(03330.HK)跌5.58%。消息方面，国际金价持续走弱，盘中一度回落至4021美元附近，目前回升至4105美元附近。,2025-10-22,09:26:17
上海前三季度居民人均可支配收入69220元 同比增长4.3%,【上海前三季度居民人均可支配收入69220元 同比增长4.3%】财联社10月22日电，上海市统计局发布数据显示，前三季度，全市居民人均可支配收入69220元，同比增长4.3%。其中，城镇常住居民人均可支配收入增长4.2%，农村常住居民人均可支配收入增长5.4%。前三季度，全市城镇调查失业率平均值为4.2%。,2025-10-22,09:26:39
黄金板块大幅低开 多股跌超9%,【黄金板块大幅低开 多股跌超9%】财联社10月22日电，黄金股大幅低开，晓程科技、湖南白银、招金黄金、盛达资源跌超9%。消息面上，国际金银大幅收跌，COMEX黄金期货跌5.07%，报4138.5美元/盎司；现货黄金跌5.18%，报4130.41美元/盎司，盘中一度创自2013年4月以来的最大单日跌幅。,2025-10-22,09:26:47
三大指数集体低开,【三大指数集体低开】财联社10月22日电，沪指低开0.52%，深成指低开0.70%，创业板指低开0.73%，贵金属、煤炭、半导体等板块指数跌幅居前。,2025-10-22,09:27:25
竞价看龙头,【竞价看龙头】财联社10月22日电，市场焦点股大有能源（12天8板）高开5.13%，投资新能源赛道的蓝丰生化（16天9板）高开2.93%，长鑫存储概念股合肥城建（12天7板）高开4.96%，上海微电子概念股华建集团（13天7板）竞价跌停、上实发展（5天3板）高开3.27%，燃气板块先锋电子（3板）高开3.52%、百川能源（2板）平开，深地经济概念股德石股份（创业板2板）高开9.82%、神开股份（2板）竞价涨停，超硬材料概念股黄河旋风（6天3板）高开5.98%、恒盛能源（2板）平开。,2025-10-22,09:27:59
上交所：N应流转（113697）盘中临时停牌,【上交所：N应流转（113697）盘中临时停牌】财联社10月22日电，上交所公告，N应流转（113697）今日上午交易出现异常波动。根据《上海证券交易所可转换公司债券交易实施细则》的有关规定，本所决定，自2025年10月22日09时25分开始暂停N应流转（113697）交易，自2025年10月22日14时57分起恢复交易。,2025-10-22,09:30:50
深地经济概念延续强势 中信重工等多股3连板,【深地经济概念延续强势 中信重工等多股3连板】财联社10月22日电，早盘深地经济概念延续强势，中信重工、石化机械、神开股份3连板，中裕科技、德石股份、中化岩土、石化油服涨幅靠前。消息面上，近日，自然资源部表示，“十五五”期间，自然资源标准化工作将聚焦：加快抢占深海、深地等新兴和未来产业的标准化制高点。,2025-10-22,09:30:55
,财联社10月22日电，恒生科技指数下跌1.1%至5941.87点。,2025-10-22,09:31:50
湖北国资概念延续强势 武汉控股、湖北广电双双2连板,【湖北国资概念延续强势 武汉控股、湖北广电双双2连板】财联社10月22日电，湖北国资概念延续强势，武汉控股、湖北广电双双2连板，理工光科、东湖高新涨超6%。消息面上，10月16日，省委副书记、省长李殿勋在武汉市调研国有“三资”管理改革并召开推进会部署安排重点任务。“一切国有资源尽可能资产化、一切国有资产尽可能证券化、一切国有资金尽可能杠杆化”三项原则。,2025-10-22,09:32:26
创新药概念震荡反弹 昂利康涨停,【创新药概念震荡反弹 昂利康涨停】财联社10月22日电，早盘创新药概念震荡反弹，昂利康涨停，科拓生物涨超10%，上海谊众、舒泰神、热景生物、益方生物跟涨。消息面上，10月22日，信达生物宣布与武田制药达成全球战略合作，共同推进新一代免疫肿瘤（IO）及抗体药物偶联物（ADC）疗法开发。公司将获得12亿美元的首付款，公司亦有权获得合计最高可达102亿美元的潜在里程碑付款，本次合作交易总金额最高可达114亿美元。,2025-10-22,09:34:14
湖北前三季度GDP同比增长6％,【湖北前三季度GDP同比增长6％】财联社10月22日电，湖北省统计局10月21日发布2025年前三季度湖北经济运行情况。根据地区生产总值统一核算结果，前三季度湖北省实现生产总值44875.62亿元，按不变价格计算，同比增长6.0%。分产业看，第一产业增加值3855.36亿元，增长3.2%；第二产业增加值17072.96亿元，增长5.9%；第三产业增加值23947.30亿元，增长6.5%。,2025-10-22,09:34:28
