标题,摘要,发布时间,链接
“清仓”百利天恒后 德福投资“入主”莱茵生物扩张资本版图,【“清仓”百利天恒后 德福投资“入主”莱茵生物扩张资本版图】12月9日晚，莱茵生物公告将进行控制权变更、发行股份及支付现金购买资产并募集配套资金，一系列资本动态下，公司自12月10日起停牌不超过10个交易日。,2025-12-11 13:38:06,https://finance.eastmoney.com/a/202512113588749366.html
“特朗普非常重视与中国建立‘建设性’关系”,【“特朗普非常重视与中国建立‘建设性’关系”】据香港《南华早报》报道，美国贸易代表贾米森·格里尔10日在美国智库大西洋理事会举办的活动上称，美国正致力于与中国构建更具“建设性”关系。,2025-12-11 13:37:46,https://finance.eastmoney.com/a/202512113588749194.html
聚点新能回应充电桩“暗箱操作”相关质疑：不存在人为操控计量行为,【聚点新能回应充电桩“暗箱操作”相关质疑：不存在人为操控计量行为】12月11日，聚点新能发布关于网传充电桩“暗箱操作”相关质疑的声明称，针对近期媒体报道中提及的充电桩“暗箱操作”相关内容，公司高度重视并第一时间开展内部全面核查。经核查，公司始终严格遵守国家计量法规及充电行业规范，所有充电桩设备均通过法定计量检测机构校准，不存在人为操控计量、违规牟利的“暗箱操作”行为。,2025-12-11 13:35:23,https://finance.eastmoney.com/a/202512113588747031.html
争辩“AI失业论”：全球8亿岗位将遭AI冲击？人机协同将成主流！AI精英解锁高薪红利,【争辩“AI失业论”：全球8亿岗位将遭AI冲击？人机协同将成主流！AI精英解锁高薪红利】近日，橡树资本管理联合创始人霍华德·马克斯（Howard Marks）警告称，AI可能对就业造成“令人恐惧”的冲击，而市场对生产率提升的乐观预期忽视了社会承受能力。对此，也有不同意见。摩根大通董事长戴蒙公开驳斥“AI失业论”。他认为，AI不会导致就业骤减。,2025-12-11 13:31:58,https://finance.eastmoney.com/a/202512113588745422.html
高市早苗上任50天 日本经济压力更大了：四季度或再现负增长,【高市早苗上任50天 日本经济压力更大了：四季度或再现负增长】12月8日，日本最新民调显示，高市早苗内阁支持率较上个月下降6.2个百分点，来到75.8%，不支持率上升6.4个百分点，为20.7%。而在12月5日NHK民调中，高市内阁的支持率为64%，比上个月略低两个百分点；不支持率上升4个百分点，到19%。,2025-12-11 13:31:22,https://finance.eastmoney.com/a/202512113588745135.html
韩国光州一图书馆施工现场发生坍塌 有人员被埋,【韩国光州一图书馆施工现场发生坍塌 有人员被埋】当地时间11日，韩国光州市一图书馆施工现场发生坍塌事故，有施工人员被埋。,2025-12-11 13:30:19,https://finance.eastmoney.com/a/202512113588743053.html
超讯通信被责令改正 涉收入核算不准确等,【超讯通信被责令改正 涉收入核算不准确等】近日，广东证监局发布了行政监管措施决定书，剑指超讯通信股份有限公司及梁建华、钟海辉、胡红月。决定书显示，超讯通信股份有限公司存在以下问题：收入核算不准确；定期报告收入跨期核算；内部控制不规范。,2025-12-11 13:27:18,https://finance.eastmoney.com/a/202512113588740066.html
英伟达软件可选服务支持数据中心集群管理,【英伟达软件可选服务支持数据中心集群管理】12月11日，界面新闻获悉，NVIDIA正在开发用于可视化和监测NVIDIA GPU集群的软件解决方案。该项可选服务可让数据中心运营商监测整个AI GPU集群运行状况，监测GPU使用情况、配置和错误，最大限度地延长正常运行时间。,2025-12-11 13:26:22,https://finance.eastmoney.com/a/202512113588736569.html
冰雪旅游“热雪”涌动 四川提振冰雪消费,【冰雪旅游“热雪”涌动 四川提振冰雪消费】随着今年冬季冰雪旅游热度攀升，四川的冰雪旅游也以蓬勃之势“破圈”而出。从西岭雪山“窗含西岭千秋雪”的诗意景观，到峨眉山金顶的银装素裹，再到滑雪场人潮涌动的热闹场景，一场以“冰雪”为纽带的文旅消费新图景正在“天府之国”渐次展开。,2025-12-11 13:25:20,https://finance.eastmoney.com/a/202512113588741683.html
上海高质量孵化器增至18家,【上海高质量孵化器增至18家】记者昨天从市科委获悉，巢生上海创新孵化平台、司南脑机智能孵化器、上海埃米三江新材料产业创新中心、“数通链谷”区块链应用创新孵化器、“大零号湾”科创策源孵化器、张江高科895孵化器等6家孵化器纳入新一轮高质量孵化器名单。截至目前，上海一共启动建设了18家高质量孵化器。,2025-12-11 13:25:13,https://finance.eastmoney.com/a/202512113588735087.html
北证50指数拉升涨超5%,北证50指数拉升涨超5%，驰诚股份、天力复合涨停，大鹏工业、科强股份、精创电气、天马新材、优机股份等涨幅居前。,2025-12-11 13:23:45,https://finance.eastmoney.com/a/202512113588731848.html
甘李药业在研新药进度落后同行 Q3业绩环比双降 应收账款激增147％藏隐忧,【甘李药业在研新药进度落后同行 Q3业绩环比双降 应收账款激增147％藏隐忧】甘李药业股份有限公司近日宣布，其全资子公司甘李药业山东有限公司已获得国家药品监督管理局下发的《药物临床试验批准通知书》，同意在研药品GLR1044注射液开展临床试验。,2025-12-11 13:23:16,https://finance.eastmoney.com/a/202512113588733442.html
大韩航空今年中国航线乘客数量大幅增长,【大韩航空今年中国航线乘客数量大幅增长】大韩航空12月11日公布数据显示，今年中国航线乘客数量较去年显著增长。从韩国飞往上海的航线乘客人数同比增加12.8万人，在各条赴华航线中增幅最为显著。北京航线乘客增加7.1万人次，青岛增加6.3万人次，均较去年大幅上升。,2025-12-11 13:20:20,https://finance.eastmoney.com/a/202512113588727382.html
北证50指数涨幅扩大至4% 成分股中天力复合30cm涨停,北证50指数涨幅扩大至4%，成分股中天力复合30cm涨停。,2025-12-11 13:18:59,https://finance.eastmoney.com/a/202512113588725418.html
盘后暴跌11%！甲骨文上财季营收不及预期 强调AI基建资金远低于外界预期,【盘后暴跌11%！甲骨文上财季营收不及预期 强调AI基建资金远低于外界预期】云服务供应商甲骨文（Oracle）上财季营收低于预期，令投资者对公司在AI（人工智能）领域的巨额投资感到担忧。,2025-12-11 13:18:10,https://finance.eastmoney.com/a/202512113588728961.html
金固股份：2025年10~11月 阿凡达车轮销售延续了积极态势,【金固股份：2025年10~11月 阿凡达车轮销售延续了积极态势】金固股份（002488.SZ）12月10日在投资者互动平台表示，2025年10~11月，阿凡达车轮销售延续了积极态势。我们通过产能优化为长期向好奠定基础。,2025-12-11 13:14:12,https://finance.eastmoney.com/a/202512113588720563.html
易华录：1TB容量光盘的研发正在稳步推进,【易华录：1TB容量光盘的研发正在稳步推进】易华录（300212.SZ）12月11日在投资者互动平台表示，1TB容量光盘的研发正在稳步推进，为保障核心部件稳定供应，华录集团通过自建产线的方式实现自主可控供应。,2025-12-11 13:14:07,https://finance.eastmoney.com/a/202512113588719245.html
同兴达：公司客户有三星、小米、OPPO、荣耀及大疆等企业,【同兴达：公司客户有三星、小米、OPPO、荣耀及大疆等企业】同兴达（002845.SZ）12月11日在投资者互动平台表示，我司客户有三星、小米、OPPO、荣耀及大疆等企业。,2025-12-11 13:14:07,https://finance.eastmoney.com/a/202512113588718625.html
北证50指数午后直线拉升涨超2%,北证50指数午后直线拉升涨超2%。,2025-12-11 13:13:23,https://finance.eastmoney.com/a/202512113588716175.html
华锐精密发布“智加”工业软件 20余家客户现场签约认购,【华锐精密发布“智加”工业软件 20余家客户现场签约认购】华锐精密今日举行“数智为核智加破界”主题新品发布会，发布华锐“智加”工业软件，财联社记者获悉，有20余家国内外客户现场签约认购该系统。,2025-12-11 13:10:20,https://finance.eastmoney.com/a/202512113588712432.html
海特生物杨坤：双轨布局应对行业变革 锚定先进治疗药创新机遇,【海特生物杨坤：双轨布局应对行业变革 锚定先进治疗药创新机遇】杨坤表示，海特生物原先的产品线主要聚焦于生物药，尤其是生物创新药，但公司并未固守单一赛道。为应对市场变化并主动捕捉机遇，公司已立项一批仿制药项目，并正积极申报参与国家集采。,2025-12-11 13:09:40,https://finance.eastmoney.com/a/202512113588714994.html
宇信科技副总裁韩冬：金融提质增效的核心是通过增量带动存量,【宇信科技副总裁韩冬：金融提质增效的核心是通过增量带动存量】宇信科技（300674.SZ）副总裁韩冬表示，金融提质增效，不是增量创新业务的独立增长，而是增量所代表的先进生产力要素被成功注入存量肌体，使得整个金融体系完成新陈代谢和升级跃迁，从而实现全系统、全要素、全链路的真正“提质增效”。,2025-12-11 13:09:37,https://finance.eastmoney.com/a/202512113588713995.html
创业板指翻绿 早盘一度涨超1%,创业板指翻绿，早盘一度涨超1%，深证成指跌0.39%，沪指跌0.57%，全市场超4200只个股飘绿。,2025-12-11 13:08:50,https://finance.eastmoney.com/a/202512113588710850.html
中兴通讯AH股午后跌幅扩大,中兴通讯A股午后开盘跌幅扩大至9%，港股跌超10%。中兴通讯在港交所公告，反对一切形式的腐败行为，正与美国司法部就有关事项进行沟通。,2025-12-11 13:05:59,https://finance.eastmoney.com/a/202512113588708724.html
最后通牒？特朗普施压泽连斯基：12月25日前接受“和平计划”,【最后通牒？特朗普施压泽连斯基：12月25日前接受“和平计划”】综合央视新闻等媒体报道，美国要求乌克兰总统泽连斯基对特朗普政府的和平计划迅速做出回应，旨在12月25日圣诞节之前达成俄乌停火协议。乌克兰总统泽连斯基最近忙于在欧洲开展外交攻势。分析认为，这很可能是因为美国总统特朗普给他下最后通牒，要求他在12月25日（圣诞节）到来前接受美方提出的“和平计划”。,2025-12-11 13:04:41,https://finance.eastmoney.com/a/202512113588708065.html
大洋电机：公司前瞻技术研究院于2025年2月设立“人形机器人电机”项目组 目前项目尚处于研发阶段,【大洋电机：公司前瞻技术研究院于2025年2月设立“人形机器人电机”项目组 目前项目尚处于研发阶段】大洋电机（002249.SZ）12月11日在投资者互动平台表示，公司前瞻技术研究院于2025年2月设立“人形机器人电机”项目组，目前已完成机器人关节模组方案设计，产品可适配于外骨骼机器人。目前项目尚处于研发阶段，未形成营业收入，短期内不会对公司业绩产生重大影响。,2025-12-11 13:04:23,https://finance.eastmoney.com/a/202512113588706843.html
罗博特科：全资子公司ficonTEC的设备可应用于OCS技术路线,【罗博特科：全资子公司ficonTEC的设备可应用于OCS技术路线】罗博特科（300757.SZ）12月11日在投资者互动平台表示，全资子公司ficonTEC的设备可应用于OCS技术路线。,2025-12-11 13:04:21,https://finance.eastmoney.com/a/202512113588706951.html
温州宏丰：公司生产的电接触材料、金属基功能复合材料及硬质合金材料均可应用于航空航天领域,【温州宏丰：公司生产的电接触材料、金属基功能复合材料及硬质合金材料均可应用于航空航天领域】温州宏丰（300283.SZ）12月11日在投资者互动平台表示，公司生产的电接触材料、金属基功能复合材料及硬质合金材料均可应用于航空航天领域。,2025-12-11 13:04:20,https://finance.eastmoney.com/a/202512113588707159.html
奥克股份：公司在固态电解质领域的应用材料尚处于开发阶段,【奥克股份：公司在固态电解质领域的应用材料尚处于开发阶段】奥克股份（300082.SZ）12月11日在投资者互动平台表示，公司在固态电解质领域的应用材料尚处于开发阶段，参股公司在固态电池材料方面的研究情况敬请参阅其官方网站及公开信息，或电话向其咨询。,2025-12-11 13:04:17,https://finance.eastmoney.com/a/202512113588707775.html
盈趣科技：公司在机器人领域主要产品有工业测试机器人、轻量级智能运输机器人等,【盈趣科技：公司在机器人领域主要产品有工业测试机器人、轻量级智能运输机器人等】盈趣科技（002925.SZ）12月11日在投资者互动平台表示，公司在机器人领域主要产品有工业测试机器人、轻量级智能运输机器人等，暂未布局具身机器人领域。,2025-12-11 13:04:17,https://finance.eastmoney.com/a/202512113588707392.html
领益智造：公司已为多家北美和国内行业头部客户提供核心硬件,【领益智造：公司已为多家北美和国内行业头部客户提供核心硬件】领益智造（002600.SZ）12月11日在投资者互动平台表示，公司已为多家北美和国内行业头部客户提供核心硬件，公司因与客户签署了商业保密协议，具体合作信息受到商业保密协议的约束不便披露。,2025-12-11 13:04:13,https://finance.eastmoney.com/a/202512113588708284.html
新股京东工业转涨 早盘一度跌超8%,新股京东工业转涨，早盘一度跌超8%。,2025-12-11 13:02:11,https://finance.eastmoney.com/a/202512113588704980.html
免税新协议签署何时披露？上海机场：正在根据有关政策要求抓紧开展相关工作,【免税新协议签署何时披露？上海机场：正在根据有关政策要求抓紧开展相关工作】12月11日，上海机场（600009.SH）以网络互动形式召开第三季度业绩说明会。对于机场免税项目新协议的签署进展，上海机场董事、副总经理李政佳回应称，公司正在根据有关政策要求抓紧开展相关工作。,2025-12-11 13:01:09,https://finance.eastmoney.com/a/202512113588703620.html
中兴通讯：正与美国司法部就有关事项进行沟通 目前生产经营一切正常,【中兴通讯：正与美国司法部就有关事项进行沟通 目前生产经营一切正常】12月11日午间，中兴通讯发布公告称，公司董事会已知悉近期新闻媒体针对公司涉及美国《反海外腐败法》合规性调查的报道。公司正与美国司法部就有关事项进行沟通，并将通过法律等手段坚决维护自身权益。公司目前生产经营一切正常。12月11日，一则有关“中兴通讯可能因涉嫌海外行贿向美国支付超过10亿美元的和解金”的消息在市场发酵。受此影响，中兴通讯A股、H股11日早盘双双下跌。,2025-12-11 12:57:53,https://finance.eastmoney.com/a/202512113588702240.html
微软计划周五推出新的代理式人工智能模型,微软首席执行官表示，微软计划周五推出新的代理式人工智能模型。,2025-12-11 12:55:25,https://finance.eastmoney.com/a/202512113588702352.html
大热门沐曦股份2万股遭弃购！超500万股民抢购 券商“捡漏”200万元,【大热门沐曦股份2万股遭弃购！超500万股民抢购 券商“捡漏”200万元】公告显示，网上、网下投资者放弃认购的股数全部由保荐人（主承销商）包销，本次保荐人（主承销商）包销股份的数量为20349股，包销金额为212.97万元，包销股份的数量占扣除最终战略配售后发行数量的比例为0.06%，包销股份的数量占本次发行数量的比例为0.05%。沐曦股份的保荐人（主承销商）为华泰联合证券有限责任公司。,2025-12-11 12:54:10,https://finance.eastmoney.com/a/202512113588701893.html
中国互联网金融协会召开供应链金融业务会员座谈会,【中国互联网金融协会召开供应链金融业务会员座谈会】中国互联网金融协会在北京组织召开供应链金融业务会员座谈会。协会秘书长马超指出，协会按照《通知》要求积极推进自律管理各项工作，目前基本实现对账款凭证主要从业机构的自律管理触达，初步建立业务统计监测机制，基本摸清市场底数，持续宣贯先规范再发展的指导思想，助推凭证期限合理控制、融资成本持续下行，引导弱小平台有序退出，及时处理相关风险事件。,2025-12-11 12:51:29,https://finance.eastmoney.com/a/202512113588701168.html
快评：让“新假期”不假，关键在“配套”,【快评：让“新假期”不假，关键在“配套”】无论大人孩子，对有效假期的渴望，就是对幸福生活的渴望。做好配套，让“新假期”真正成为孩子成长的“加油站”、家庭和睦的“调味剂”、经济发展的“催化剂”，让每个家庭都能在匆匆忙忙中多一些从从容容，把日子过成幸福模样。,2025-12-11 12:50:24,https://finance.eastmoney.com/a/202512113588700955.html
今日上市！刘强东资本版图+1,【今日上市！刘强东资本版图+1】“京东系”版图再度扩张！京东工业12月11日正式于港交所主板上市，股票代码为7618。据港交所12月10日晚公告，京东工业公开发售价定为每股14.1港元，若不行使超额配股权，全球发售募集资金净额约28.27亿港元。记者注意到，京东工业也是继京东集团港股二次上市，京东健康、京东物流赴港IPO之后，“京东系”的第四家港股上市公司。,2025-12-11 12:49:39,https://finance.eastmoney.com/a/202512113588701330.html
多家国际机构上调中国经济增速预期,【多家国际机构上调中国经济增速预期】近日多家国际机构密集上调2025年中国经济增速预期。其中，世界银行、国际货币基金组织、亚洲开发银行分别上调0.4、0.2、0.1个百分点。,2025-12-11 12:47:53,https://finance.eastmoney.com/a/202512113588700389.html
中国兵器工业集团与陕西签订4个重大合作项目,【中国兵器工业集团与陕西签订4个重大合作项目】12月10日，中国兵器工业集团有限公司与陕西协同创新与成果转化推广会在西安兵器基地举办。会上，兵器工业集团分别与西安市碑林区、西北有色金属研究院、西安交通大学、西安电子科技大学签订兵器工业西北区域总部科创中心等4个重大项目。,2025-12-11 12:47:33,https://finance.eastmoney.com/a/202512113588699974.html
摩根大通策略师预计美联储明年只会再降息一次,【摩根大通策略师预计美联储明年只会再降息一次】据摩根大通私人银行，随着美国就业市场趋于稳定或改善，美联储降息力度可能会比市场预期的要小。全球投资策略师Weiheng Chen在一份报告中写道，预计FOMC将在2026年再进行一次幅度25个基点的降息，明显少于目前市场预期的约50个基点。降息最终是否会实现，可能取决于劳动力市场的情况。该机构认为，美国劳动力市场将趋于稳定甚至改善。,2025-12-11 12:45:47,https://finance.eastmoney.com/a/202512113588699865.html
杠杆超百倍、交易转入地下 水贝黄金赌局“变脸”重来,【杠杆超百倍、交易转入地下 水贝黄金赌局“变脸”重来】第一财经实测多家水贝黄金预定价交易平台发现，线上预定价交易并未消失，而是转入更深层的对接流程，操作门槛明显提高。总体来看，与此前简单注册即可查看预定价交易信息不同，目前大多数平台均要求用户提交身份证照片、银行卡号等资料进行实名认证，联系客服后还需经过人工审核，整体流程通常耗时一天左右。部分平台还新增了投资者风险评估环节，需要提供评估后才可参与预定价交易。,2025-12-11 12:44:08,https://finance.eastmoney.com/a/202512113588701738.html
AMD大中华区纪朝晖：AI Agent推动AI从对话工具向生产力跃迁,【AMD大中华区纪朝晖：AI Agent推动AI从对话工具向生产力跃迁】AMD大中华区市场营销副总裁纪朝晖表示，2025年开启了AIAgent“元十年”，AIAgent是将AI从对话机器人转变为生产力的关键，是“AI+千行万业”进入快车道的转折点。“我们期待继续以强大的技术实力为下一代智能计算提供核心动力，与MINISFORUM铭凡共同推动行业发展。”,2025-12-11 12:43:14,https://finance.eastmoney.com/a/202512113588699711.html
元拾科技成为英伟达Rubin服务器机柜开发主力,【元拾科技成为英伟达Rubin服务器机柜开发主力】近日，凭借稀缺RVL认证资质与核心技术积累，元拾科技正式切入英伟达下一代主力服务器VeraRubin开发团队，担任核心开发角色，深度参与该平台关键硬件的研发与落地。近期蓝思科技通过收购获得元拾科技95.12%股权，为其提供充足市场、产能资源支持，助力其在AI算力硬件赛道持续突破。,2025-12-11 12:43:14,https://finance.eastmoney.com/a/202512113588699698.html
TCL：年内AI应用创造综合效益超10亿元,【TCL：年内AI应用创造综合效益超10亿元】TCL科技首席技术官、TCL华星首席技术官闫晓林在TCL全球技术创新大会TIC2025上表示，面板显示正在用AI技术提升效率和良率。年内TCL推进AI应用创造综合效益超10亿元。,2025-12-11 12:42:07,https://finance.eastmoney.com/a/202512113588699510.html
工业和信息化部召开制造业中试创新发展座谈会,【工业和信息化部召开制造业中试创新发展座谈会】工业和信息化部在辽宁省盘锦市召开制造业中试创新发展座谈会，会议强调，要立足“十四五”规划收官与“十五五”谋篇布局这一关键节点，系统推进制造业中试创新发展。要强化中试工作顶层谋划，一体推动战略、规划、政策、标准等联动实施，健全促进融合发展的体制机制。,2025-12-11 12:38:53,https://finance.eastmoney.com/a/202512113588697316.html
喜茶一年关店超650家 关联公司过半分支机构被注销,【喜茶一年关店超650家 关联公司过半分支机构被注销】12月11日，喜茶关店超600家受到关注，在社交媒体引发大量讨论。据极海品牌监测数据，2024年10月，喜茶全国总门店数为4610家；至2025年10月，门店总数减少至3930家，一年间门店净减少680家。另据壹览商业统计数据，至2025年10月，喜茶门店总数为3903家，较去年同期的4614家减少711家，同比降幅达15.41%。,2025-12-11 12:37:44,https://finance.eastmoney.com/a/202512113588699480.html
中金资本等入股积塔半导体,【中金资本等入股积塔半导体】天眼查工商信息显示，近日，上海积塔半导体有限公司发生工商变更，新增中电金投控股有限公司、中电中金（厦门）智能产业股权投资基金合伙企业（有限合伙）、重庆中金科元私募股权投资基金合伙企业（有限合伙）等为股东，注册资本由约169亿人民币增至约179亿人民币，增幅约6%，同时，多位主要人员发生变更。,2025-12-11 12:35:10,https://finance.eastmoney.com/a/202512113588697162.html
鲍威尔的“最后一降”？美联储内部3票反对创6年最多 2026年利率决议成谜,【鲍威尔的“最后一降”？美联储内部3票反对创6年最多 2026年利率决议成谜】加拿大皇家银行旗下资管机构BlueBay资产管理公司首席投资官Mark Dowding在接受记者采访时表示，本周会议很可能是鲍威尔卸任前的最后一次利率调整。关于明年的货币政策走向，市场担忧，若目前呼声最高的白宫国家经济委员会主任凯文·哈塞特（Kevin Hassett）接替鲍威尔成为下一任美联储主席，可能会为了迎合白宫的意愿大幅降息。,2025-12-11 12:29:05,https://finance.eastmoney.com/a/202512113588697251.html
商务部新闻发言人就墨西哥国会审议通过对非自贸伙伴的提税提案答记者问,【商务部新闻发言人就墨西哥国会审议通过对非自贸伙伴的提税提案答记者问】中方一贯反对各种形式的单边加征关税措施，希望墨方及早纠正这种单边主义、保护主义的错误做法。为维护中国相关产业利益，商务部已于9月底依法对墨启动了贸易投资壁垒调查，目前调查正在进行中。,2025-12-11 12:26:44,https://finance.eastmoney.com/a/202512113588695735.html
