标题,摘要,发布时间,链接
1160亿重组终止 中科曙光、海光信息后续走势说明了什么？,【1160亿重组终止 中科曙光、海光信息后续走势说明了什么？】“此次重组终止，对于海光信息来说，更多是情绪利空反应；对于中科曙光而言，则是大利空。”有投资者对界面新闻指出，除了产业链整合优势外，海光信息若合并中科曙光，毛利率将降低，市场竞争灵活度也会下降，合并起来的性价比不是很高，但中科曙光被合并则可以直接吃20%的换股溢价。,2025-12-11 12:26:10,https://finance.eastmoney.com/a/202512113588696967.html
多家银行拟取消监事会,【多家银行拟取消监事会】浙商银行、渝农商行12月10日发布公告宣布拟取消监事会。据不完全统计，今年以来，已超20家银行宣布不再设立监事会或披露相关计划。业内人士指出，取消监事会的银行将由董事会审计委员会承接监事会职权，这有助于提升公司治理效率、降低运营成本，但需确保监督的独立性、专业性与有效性。,2025-12-11 12:26:05,https://finance.eastmoney.com/a/202512113588695538.html
中兴通讯：正与美国司法部就有关事项进行沟通,【中兴通讯：正与美国司法部就有关事项进行沟通】中兴通讯(00763.HK)公告，公司已知悉近期新闻媒体针对本公司涉及美国《反海外腐败法》合规性调查的报道。本公司正与美国司法部就有关事项进行沟通，并将通过法律等手段坚决维护自身权益。,2025-12-11 12:25:05,https://finance.eastmoney.com/a/202512113588694771.html
美国ITC发布对无线通信设备及其组件的337部分终裁,"【美国ITC发布对无线通信设备及其组件的337部分终裁】据中国贸易救济信息网，12月10日，美国国际贸易委员会（ITC）发布公告称，对特定无线通信设备及其组件（Certain Wireless Communication Devices and Components Thereof，调查编码：337-TA-1429）作出337部分终裁：对本案行政法官于2025年9月29日作出的初裁（No.41）不予复审，即基于和解，终止对列名被告美国HP, Inc. of Palo Alto, CA的调查。",2025-12-11 12:17:59,https://finance.eastmoney.com/a/202512113588692631.html
美国ITC发布对聚偏二氟乙烯树脂的337部分终裁,"【美国ITC发布对聚偏二氟乙烯树脂的337部分终裁】据中国贸易救济信息网，12月9日，美国国际贸易委员会（ITC）发布公告称，对特定聚偏二氟乙烯树脂（Certain Polyvinylidene Fluoride Resins，调查编码：337-TA-1439）作出337部分终裁：对本案行政法官于2025年11月18日作出的初裁（No.19）不予复审，即基于申请方提出的申请进行更名，将Solvay Specialty Polymers, USA LLC更正为Syensqo Specialty Polymers, USA LLC，将Solvay Specialty Polymers Italy S.P.A更正为Syensqo Specialty Polymers Italy S.P.A.。",2025-12-11 12:15:14,https://finance.eastmoney.com/a/202512113588692129.html
野村：韩国Kospi指数明年上半年料触及5000点 受AI资本支出激增推动,"【野村：韩国Kospi指数明年上半年料触及5000点 受AI资本支出激增推动】野村预计，受半导体超级周期和持续推进的公司治理改革推动，韩国基准Kospi指数2026年上半年将升至5,000点。“随着半导体超级周期与韩国股市/公司治理改革形成协同效应，我们认为韩国股市有进一步上涨空间，” Cindy Park、CW Chung等分析师在报告中写道。该行给出的目标位较周三收盘位4,135点有21%的上行空间。上半年首选买入标的为三星电子和SK海力士，其次是现代汽车、Doosan Enerbility、韩国电力公司、Samsung Biologics和Hyundai Rotem。把现代汽车目标价上调16%至370,000韩元，理由是与同行的估值差距正在缩小。",2025-12-11 12:13:46,https://finance.eastmoney.com/a/202512113588691966.html
港股午评：恒生指数涨0.09% 恒生科技指数跌0.65%,【港股午评：恒生指数涨0.09% 恒生科技指数跌0.65%】港股午间收盘，恒生指数涨0.09%，恒生科技指数跌0.65%。风电股强势，金风科技涨近7%，东方电气涨逾4%。半导体股走弱，华虹半导体、中芯国际跌逾2%。京东工业上市首日午间收跌0.07%，开盘一度跌超8%。,2025-12-11 12:10:10,https://finance.eastmoney.com/a/202512113588691694.html
12月11日午间新闻精选,【12月11日午间新闻精选】1、截至午间收盘，沪指跌0.46%，深证成指跌0.18%，创业板指涨0.3%。2、港股午间收盘，恒生指数涨0.09%，恒生科技指数跌0.65%。,2025-12-11 12:04:54,https://finance.eastmoney.com/a/202512113588691553.html
江苏：今年地区生产总值有信心突破14万亿元,【江苏：今年地区生产总值有信心突破14万亿元】“第二经济大省”江苏今年的地区生产总值将再上一个万亿元台阶。12月11日，《中共江苏省委关于制定江苏省国民经济和社会发展第十五个五年规划的建议》发布。在总结“十四五”时期发展成就时，《建议》表示“经济实力显著提升，全省地区生产总值预计突破14万亿元”。10日，江苏省发改委副主任林康在省政府新闻办公室举行的发布会上说，“十四五”以来，全省地区生产总值已连跨3个万亿元台阶，今年有信心突破14万亿元。2021年，江苏的GDP超过11万亿元，2022年超过12万亿元，2024年超过13万亿元。综合实力稳步增强的同时，江苏更为注重发展质效，全员劳动生产率由2020年的21.3万元/人提升至2024年的28.4万元/人，2021年至2024年的全员劳动生产率年均增速高于GDP年均增速0.5个百分点。目前，江苏13个设区市的经济总量全部进入全国百强，苏州、南京、无锡、南通、常州GDP过万亿，是“万亿城市”最多的省份，苏北的徐州市有望在今年晋级。,2025-12-11 11:59:10,https://finance.eastmoney.com/a/202512113588690496.html
午间公告：新诺威已向香港联交所递交H股发行上市申请,【午间公告：新诺威已向香港联交所递交H股发行上市申请】多家公司发布午间公告：①新诺威：公司已于2025年12月10日向香港联交所递交了发行境外上市股份（H股）并在香港联交所主板挂牌上市的申请，并于同日在香港联交所网站刊登了本次发行上市的申请资料。②明阳电路：截至公告披露时，距离“明电转02”停止转股仅剩最后半个交易日（即12月11日下午交易时段），收市后未实施转股的“明电转02”将停止转股，剩余可转债将按照100.44元/张的价格被强制赎回。若被强制赎回，投资者可能面临投资损失。③海融科技：公司拟变更募投资项目“科技研发中心建设项目”投资总额。变更后，该项目投资总额为6342.96万元，较变更前减少5559.47万元。其中，使用募集资金6342.96万元，较变更前减少5559.47万元。,2025-12-11 11:58:31,https://finance.eastmoney.com/a/202512113588690381.html
日本5年期国债收益率下跌2.5个基点,【日本5年期国债收益率下跌2.5个基点】日本5年期国债收益率下跌2.5个基点，至1.420%。20年期日本国债收益率下跌4个基点，至2.905%。,2025-12-11 11:56:14,https://finance.eastmoney.com/a/202512113588690178.html
中国驻日本大使馆提醒在日中国公民进行“海外公民登记”,【中国驻日本大使馆提醒在日中国公民进行“海外公民登记”】据中国驻日本大使馆消息，为有效保护在日中国公民人身安全，进一步帮助在日中国公民更好获得领事保护与服务，外交部“中国领事”APP推出“海外公民登记”功能模块并已全面上线。中国驻日本大使馆提醒在日中国公民：请积极下载“中国领事”APP或通过“中国领事”微信小程序参与登记。根据自己在日居住地址选择相应都道府县，填写相关信息完成登记。请确保所填个人信息真实、准确、完整，所填信息将受到严格保护。中国驻日本使领馆将根据信息登记情况，有针对性地推送安全信息，为在日中国公民提供及时、有效的领事保护与协助。,2025-12-11 11:51:14,https://finance.eastmoney.com/a/202512113588689436.html
12月11日午间涨停分析,【12月11日午间涨停分析】今日午盘全市场共31股涨停，连板股总数10只，20股封板未遂，封板率为61%（不含ST股、退市股）。焦点股方面，福建本地股东百集团5连板、安妮股份6天5板，商业航天概念股再升科技4连板，家居股中源家居6天4板。,2025-12-11 11:49:05,https://finance.eastmoney.com/a/202512113588689329.html
灵明光子否认速腾聚创指控 准备采取法律措施反制,【灵明光子否认速腾聚创指控 准备采取法律措施反制】12月10日，针对市场诉讼传闻，深圳市灵明光子科技有限公司通过其官方微信公众号发布《关于与速腾聚创（02498.HK）案件相关情况的声明》，称该公司不存在侵犯速腾聚创专利权和技术秘密的风险，并将对速腾聚创的不实指控及不正当竞争行为采取法律反制措施。不过，《声明》发布当日因遭到投诉而无法在公众号查看，但通过灵明光子官网依然可以查看。,2025-12-11 11:41:44,https://finance.eastmoney.com/a/202512113588687994.html
日本20年期债券发售需求达到自2020年以来的最高水平,【日本20年期债券发售需求达到自2020年以来的最高水平】日本20年期债券发售需求达到自2020年以来的最高水平。,2025-12-11 11:38:31,https://finance.eastmoney.com/a/202512113588687544.html
捷豹路虎180亿英镑投资加速落地,"【捷豹路虎180亿英镑投资加速落地】在“重塑未来”全球战略指引下，捷豹路虎正按计划推进从2024财年启动的五年180亿英镑投资布局，全面加速电动化转型。其中，“Freelander神行者”车型研发工作稳步推进，首款车型预计将于2026年下半年推出，开拓更多元的细分市场。此前公布的2025/26财年第二季度（2025年7月至9月）财报显示，尽管面临充满挑战的外部环境，公司第二财季全球营收达到49亿英镑，上半财年营收为115亿英镑。截至9月30日，公司总流动资产达67亿英镑。期内，公司全球批售销量66,165台，其中，揽胜、揽胜运动版及卫士等高价值车型在批售销量中占比高达76.7%。此外，揽胜纯电版意向客户注册人数目前已增长至65,000名。",2025-12-11 11:37:29,https://finance.eastmoney.com/a/202512113588687319.html
山西银行原行长李颖耀出任山西省委金融工委副书记,【山西银行原行长李颖耀出任山西省委金融工委副书记】12月9日，山西省农商行党委举行党委理论学习中心组集体学习，围绕深入学习贯彻党的二十届四中全会精神进行专题学习研讨。省委金融工委副书记、列席旁听组组长李颖耀列席旁听。省农商行党委书记向弟海主持。省农商行党委理论学习中心组成员出席。上述消息显示，原任山西银行行长的李颖耀已出任山西省委金融工委副书记。,2025-12-11 11:36:41,https://finance.eastmoney.com/a/202512113588687647.html
创业板指涨0.30% 超导概念走强 商业百货回调,【午盘播报】沪指下跌0.46%，报3882.72点；深成指下跌0.18%，报13292.61点；创业板指上涨0.30%，报3218.55点，两市半日合计成交11572亿。盘面上，超导概念、风电设备、可控核聚变、玻璃玻纤、氦气概念、减肥药、非金属材料、熔盐储能涨幅居前，商业百货、预制菜概念、水产养殖、免税概念、社区团购、鸡肉概念表现不佳，跌幅居前。全市场上涨个股有1108家，下跌个股有4243家，34只股涨停。,2025-12-11 11:30:42,https://finance.eastmoney.com/a/202512113588686262.html
太空数据中心才是未来？贝索斯的蓝色起源也加入这一新竞争,【太空数据中心才是未来？贝索斯的蓝色起源也加入这一新竞争】数据中心的竞争已进入白热化，但地面上的竞争已经不足以满足科技巨头的雄心，一些公司正在探索太空数据中心的可能性。据一名知情人士表示，亚马逊创始人贝索斯的航天公司蓝色起源在过去一年中一直在研发太空人工智能数据中心所需的技术。,2025-12-11 11:27:02,https://finance.eastmoney.com/a/202512113588686338.html
5G概念股局部异动 东方通信直线触板,5G概念股局部异动，东方通信直线触板，梦网科技、信科移动、硕贝德等纷纷冲高。,2025-12-11 11:25:47,https://finance.eastmoney.com/a/202512113588684067.html
中兴通讯成交额达100亿,中兴通讯成交额达100亿，现跌超7%。,2025-12-11 11:24:35,https://finance.eastmoney.com/a/202512113588682948.html
卫宁健康成立卫宁云科技公司,【卫宁健康成立卫宁云科技公司】天眼查App显示，近日，卫宁云（上海）科技有限公司成立，法定代表人为周成，注册资本1000万人民币，经营范围含软件开发、专业设计服务、第一类医疗器械销售、软件销售、信息系统集成服务、信息系统运行维护服务、计算机软硬件及辅助设备批发、计算机软硬件及辅助设备零售等。股东信息显示，该公司由卫宁健康（300253）全资持股。,2025-12-11 11:24:09,https://finance.eastmoney.com/a/202512113588684616.html
聚焦“炭素+新能源材料”产业协同 方大炭素“锚定”杉杉重整,【聚焦“炭素+新能源材料”产业协同 方大炭素“锚定”杉杉重整】近日，全球炭素制品龙头方大炭素发布公告，董事会审议通过议案，同意以产业协同方身份报名参与杉杉集团有限公司及其全资子公司宁波朋泽贸易有限公司的实质合并重整投资人招募。这一举措不仅标志着资本市场又一重大重整案例迈入关键阶段，更可能成为“炭素+新能源材料”融合发展的产业协同典型。,2025-12-11 11:23:27,https://finance.eastmoney.com/a/202512113588682438.html
罗翔谈吸毒是否入刑,【罗翔谈吸毒是否入刑】人民法院报12月11日报道，近期，有关“吸毒是否入刑”引发社会热议，成为法治研究的新课题，为此，人民法院报特邀中国政法大学刑事司法学院教授、博士生导师、刑法学研究所所长罗翔撰写署名文章。,2025-12-11 11:22:44,https://finance.eastmoney.com/a/202512113588681694.html
中科宇航“一箭9星”成功发射国际客户卫星 相关板块延续涨势,【中科宇航“一箭9星”成功发射国际客户卫星 相关板块延续涨势】12月11日上午，商业航天概念延续涨势。截至10时51分，通光线缆20cm涨停，中超控股、立昂微、华菱线缆涨停，航天动力、云南锗业等跟涨。消息面上，12月10日，中科宇航力箭一号遥十一运载火箭·缔造未来号在东风商业航天创新试验区发射，采用“一箭9星”的方式，将阿联酋813卫星等卫星送入预定轨道，发射任务取得圆满成功。,2025-12-11 11:20:23,https://finance.eastmoney.com/a/202512113588682183.html
特高压工程建设进展不断 相关板块涨幅居前,【特高压工程建设进展不断 相关板块涨幅居前】截至12月11日10点47分，特高压概念指数涨幅居前。消息面上，近期，四川省发展改革委发布关于攀西特高压交流工程项目核准的批复。甘肃－浙江等多条特高压工程建设取得关键进展。多种输配电设备大额中标信息接连发布。,2025-12-11 11:20:20,https://finance.eastmoney.com/a/202512113588681046.html
北京航空发动机维修有限公司正式投运,【北京航空发动机维修有限公司正式投运】12月10日，我国航空发动机高端维修领域迎来重大突破——北京航空发动机维修项目在首都机场临空经济区天竺综保区正式开业并投入运营。作为罗罗全球第四家、中国内地首家合资发动机维修公司，该项目的运营将填补中国内地在以罗罗遄达系列为代表的高推力航空发动机维修领域的空白，显著提升民航产业链的自主维修保障能力与安全水平。,2025-12-11 11:18:42,https://finance.eastmoney.com/a/202512113588680117.html
首付款1.5亿美元 重药控股参股子公司与辉瑞达成商业合作,【首付款1.5亿美元 重药控股参股子公司与辉瑞达成商业合作】重药控股12月11日发布公告，公司参股子公司重庆药友制药有限责任公司及上海复星医药产业发展有限公司日前与辉瑞共同签订《CollaborationandLicenseAgreement》，由药友制药就口服小分子胰高血糖素样肽-1受体（GLP-1R）激动剂（包括YP05002）及含有该活性成分的产品授予辉瑞于许可区域（即全球范围）及领域独家开发、使用、生产及商业化权利。,2025-12-11 11:18:32,https://finance.eastmoney.com/a/202512113588680420.html
马斯克或成全球首个万亿美元富豪,【马斯克或成全球首个万亿美元富豪】据界面新闻，当地时间12月10日，马斯克在社交媒体平台X上暗示SpaceX可能IPO。此前有报道称这家火箭制造商可能在2026年上市。12月11日，据财经网科技援引彭博社报道，如果SpaceX能在明年以1.5万亿美元的估值成功上市，那么全球首富伊隆·马斯克的财富将在目前4606亿美元基础上增长一倍以上。,2025-12-11 11:16:32,https://finance.eastmoney.com/a/202512113588679162.html
白银再创新高 引崩盘担忧！分析师却称“这次不一样”,【白银再创新高 引崩盘担忧！分析师却称“这次不一样”】市场对白银价格飙升至十年新高产生担忧，部分投资者甚至视其为未来十年的终极顶部。这种看跌情绪源于此前两轮惨痛的历史记忆：白银在1980年和2011年两度问鼎后均迅速崩盘。历史数据显示，白银任何一次年度涨幅超过100%，都必然伴随至少50%的深度回调。不过，多位接受记者采访的分析师认为，本轮白银上涨的逻辑与过往截然不同，支撑银价的核心驱动力已然生变。,2025-12-11 11:12:55,https://finance.eastmoney.com/a/202512113588677938.html
沐曦股份：网上投资者放弃认购20349股,【沐曦股份：网上投资者放弃认购20349股】12月10日，沐曦股份发布公告称，本次发行的网上、网下认购缴款工作已于2025年12月9日（T+2日）结束。网上投资者缴款认购的股份数量为964.52万股，缴款认购的金额为10.09亿元，放弃认购20349股，放弃认购金额为212.97万元。网下投资者缴款认购的股份数量为2282.91万股，缴款认购的金额为23.89亿元，放弃认购数量0股。网上、网下投资者放弃认购的股数全部由保荐人（主承销商）包销。,2025-12-11 11:12:10,https://finance.eastmoney.com/a/202512113588679914.html
华为、支付宝、中移互联网合作布局AI+5G新通话DC生态,【华为、支付宝、中移互联网合作布局AI+5G新通话DC生态】12月10日，华为、支付宝、中移互联网正式签署合作协议，共同开启“通话即服务”的智能化通信时代。此次合作标志着三方将深化AI+5G新通话DC生态场景的联合创新，推动传统通话向智能化、服务化方向演进。,2025-12-11 11:11:32,https://finance.eastmoney.com/a/202512113588674245.html
创新药概念局部活跃 海创药业涨超11%,创新药概念局部活跃，海创药业涨超11%，前沿生物涨超8%，重药控股此前涨停，悦康药业、热景生物、回盛生物、众生药业跟涨。,2025-12-11 11:10:00,https://finance.eastmoney.com/a/202512113588672893.html
公司快评︱前三季营收、净利均降 永辉超市为何还能“三连板”？,【公司快评︱前三季营收、净利均降 永辉超市为何还能“三连板”？】永辉超市股价的三连板更多是受市场情绪和转型预期等因素影响，而公司基本面并未发生实质性改善。投资者在参与投资时，应充分考虑公司业绩亏损、大股东减持等风险因素，避免盲目跟风追涨，理性对待股价波动。,2025-12-11 11:07:18,https://finance.eastmoney.com/a/202512113588672085.html
苹果首款智能眼镜或明年发布：定位轻量穿戴、无独立算力 需与iPhone联动,【苹果首款智能眼镜或明年发布：定位轻量穿戴、无独立算力 需与iPhone联动】Apple Glasses有望在苹果全球开发者大会WWDC上面世、2027年启动量产与上市；Apple Glasses定位是苹果生态的“轻量智能穿戴配件”，不具备独立计算能力。目前苹果已暂停Vision Pro轻量版的研发。,2025-12-11 11:04:47,https://finance.eastmoney.com/a/202512113588670412.html
11月《Whiteout Survival》《Kingshot》领跑出海手游收入榜,【11月《Whiteout Survival》《Kingshot》领跑出海手游收入榜】12月11日，SensorTower应用表现洞察与运营活动洞察平台数据显示，2025年11月前后头部手游普遍抓住万圣节、黑五与感恩节等关键节假日窗口，通过高密度的运营活动有效撬动玩家消费，推动收入持续走高。,2025-12-11 11:04:46,https://finance.eastmoney.com/a/202512113588671123.html
300万仅是“入场券” 福莱蒽特设合资公司深耕触觉AI 称准备好持续投入,【300万仅是“入场券” 福莱蒽特设合资公司深耕触觉AI 称准备好持续投入】12月10日，福莱蒽特披露投资者关系活动表。公司表示，将培育“第二增长曲线”提升至战略核心，以积极应对染料行业周期性波动带来的挑战。作为该战略的关键落子，公司计划与相关方共同投资设立双曲线智能（杭州）有限公司，推动业务布局向高科技、高附加值领域延伸。,2025-12-11 11:04:39,https://finance.eastmoney.com/a/202512113588670995.html
北京进入扫雪铲冰“备战”状态,【北京进入扫雪铲冰“备战”状态】最新天气预报显示，12月12日北京即将迎来降雪天气。12月11日，据北京市城市管理委员会消息，为应对降雪带来的交通压力，各区已提前部署，组织人员和设备开展扫雪铲冰工作。,2025-12-11 11:04:37,https://finance.eastmoney.com/a/202512113588671370.html
汽车行业网络乱象专项整治行动公开曝光第二批典型案例,【汽车行业网络乱象专项整治行动公开曝光第二批典型案例】近期，国家网信办会同工业和信息化部等部门持续开展汽车行业网络乱象专项整治行动，从严整治恶意诋毁攻击、散布不实信息、开展虚假测评等违法违规行为。,2025-12-11 11:01:58,https://finance.eastmoney.com/a/202512113588668526.html
认购证暴跌25%！中兴通讯突发！,【暴跌25%！中兴通讯，突发！】今天一早，中兴通讯就刷屏了。其A股暴跌超7%，H股暴跌超8%。中兴法巴六五购A一度暴跌超25%，该品种在本月短短几个交易日内，已经腰斩。,2025-12-11 10:56:34,https://finance.eastmoney.com/a/202512113588666245.html
万科债跌幅扩大,【万科债跌幅扩大】“21万科06”跌超24%盘中临时停牌，“23万科01”跌超18%，“22万科02”跌超17%，“21万科04”跌超16%，“22万科04”和“22万科06”跌超10%，“21万科02”跌超7%。,2025-12-11 10:56:12,https://finance.eastmoney.com/a/202512113588665783.html
沪深两市成交额超1万亿元 较上日此时放量56亿元,沪深两市成交额超1万亿元，较上日此时放量56亿元。,2025-12-11 10:54:55,https://finance.eastmoney.com/a/202512113588665348.html
美科技企业加速在印布局AI 业内心存疑问,【美科技企业加速在印布局AI 业内心存疑问】美国电子商务平台亚马逊公司10日说，到2030年，将在印度投资350亿美元，用于发展人工智能(AI)产业。另一家美国大型科技企业微软公司9日也宣布计划在印度投资175亿美元建设AI基础设施。,2025-12-11 10:54:21,https://finance.eastmoney.com/a/202512113588664833.html
美股三大股指期货跌幅扩大 纳斯达克100指数期货跌1%,美股三大股指期货跌幅扩大，纳斯达克100指数期货跌1%，道琼斯指数期货跌0.18%，标普500指数期货跌0.61%。,2025-12-11 10:53:03,https://finance.eastmoney.com/a/202512113588664013.html
梦网科技：AI+5G阅信已完成智能化升级 终端覆盖超11亿台,【梦网科技：AI+5G阅信已完成智能化升级 终端覆盖超11亿台】12月10日，第二十二届增值电信及虚拟运营年会在北京召开。在5G消息及新通话创新论坛上，梦网科技表示，公司以 “5G消息/阅信”为场景基石，以“AI”为能力引擎，构建“AI+5G消息/阅信”双驱动智能通信新生态。其中，AI+5G阅信已完成强展示、高转化、智能化升级，支持20余种富媒体样式，终端覆盖超11亿台。,2025-12-11 10:50:51,https://finance.eastmoney.com/a/202512113588663048.html
