标题,摘要,发布时间,链接
连续2周超越苹果 华为手机重夺国内市场份额第一！,【连续2周超越苹果 华为手机重夺国内市场份额第一！】根据权威三方机构数据，自华为Mate80系列发布以来，华为手机国内市场份额连续2周超越苹果，重夺国内市场份额第一。,2025-12-11 14:42:24,https://finance.eastmoney.com/a/202512113588795773.html
农业农村部：长江十年禁渔取得重要阶段性成效 超14万退捕渔民全部转产就业,【农业农村部：长江十年禁渔取得重要阶段性成效 超14万退捕渔民全部转产就业】记者从农业农村部获悉，今年以来，长江十年禁渔取得重要阶段性成效。截至2025年三季度末，14.2万名有劳动能力和就业意愿的退捕渔民全部转产就业。,2025-12-11 14:38:46,https://finance.eastmoney.com/a/202512113588794878.html
摩尔线程股价突破900元 部分中签者单签浮盈或超40万元,【摩尔线程股价突破900元 部分中签者单签浮盈或超40万元】12月11日午后，摩尔线程股价进一步走高，截至发稿，盘中股价突破900元，最高一度达到930.9元，如果投资者中签摩尔线程新股且能持有至今，按今天盘中最高价计算，单签浮盈将超过40万元。,2025-12-11 14:38:37,https://finance.eastmoney.com/a/202512113588794627.html
香飘飘涉足保健食品？公司回应,【香飘飘涉足保健食品？公司回应】就拟调整经营范围一事，香飘飘10日下午回复中新经纬称，此次在公司章程中增加相关经营范围表述，是一次常规的补充修订。公司的战略重心与核心业务没有任何变化。,2025-12-11 14:37:10,https://finance.eastmoney.com/a/202512113588793977.html
正邦科技涨停 1-11月累计销售生猪收入同比增长65%,【正邦科技涨停 1-11月累计销售生猪收入同比增长65%】12月11日下午，正邦科技涨停，报3.45元/股，涨幅为9.87%。12月10日，正邦科技公告称，公司2025年11月销售生猪86.83万头（其中仔猪46.75万头，商品猪40.08万头），同比上升63.04%。,2025-12-11 14:36:21,https://finance.eastmoney.com/a/202512113588793088.html
辽宁： 加速形成“专业引领、全民参与、多元供给”的群众性冰雪赛事体系,【辽宁： 加速形成“专业引领、全民参与、多元供给”的群众性冰雪赛事体系】《辽宁省冰雪旅游高质量发展三年行动计划（2025—2027年）》公开征求意见。其中提到，紧抓“十五冬”重大机遇，以高水平冰雪赛事赋能旅游高质量发展，聚焦大众参与和市场培育，重点塑造雪合战、冰上龙舟、冰上帆船、攀冰挑战、冰凌穿越等融合地域特色与群众基础的冰雪赛事品牌，加速形成“专业引领、全民参与、多元供给”的群众性冰雪赛事体系。,2025-12-11 14:34:09,https://finance.eastmoney.com/a/202512113588791867.html
辽宁：推进重大冰雪项目旅游配套设施建设 加快由单季运营向全季发展转型,【辽宁：推进重大冰雪项目旅游配套设施建设 加快由单季运营向全季发展转型】《辽宁省冰雪旅游高质量发展三年行动计划（2025—2027年）》公开征求意见。其中提到，支持具备资源禀赋与运营基础的滑雪旅游度假地，通过标准化建设与特色化培育，积极创建省级、国家级品牌。推进抚顺龙岗山雪上运动中心、沈阳王家湾冰上运动中心等重大冰雪项目旅游配套设施建设，提升项目整体承载力与旅游体验水平。,2025-12-11 14:33:39,https://finance.eastmoney.com/a/202512113588790595.html
《辽宁冰雪旅游高质量发展三年行动计划》公开征求意见：到2027力争年综合收入逾2500亿元,【《辽宁冰雪旅游高质量发展三年行动计划》公开征求意见：到2027力争年综合收入逾2500亿元】为抢抓承办“十五冬”战略机遇，全面推进高品质冰雪旅游目的地建设，促进冰雪旅游消费提质升级，《辽宁省冰雪旅游高质量发展三年行动计划（2025—2027年）》公开征求意见。,2025-12-11 14:32:59,https://finance.eastmoney.com/a/202512113588790254.html
中汽协：汽车产销量全年有望再创历史新高,【中汽协：汽车产销量全年有望再创历史新高】12月11日，中汽协表示，11月，汽车产销延续良好表现。企业抢抓政策窗口期，生产供给依然保持较快节奏，在高基数基础上，产销环比、同比均实现增长。其中，乘用车市场运行平稳，商用车市场持续向好，新能源汽车表现强劲，汽车出口较快增长。展望全年，汽车内需市场在政策组合效应推动下有效改善，新动能加快释放，对外贸易呈现出较好韧性，汽车产销量全年有望再创历史新高，实现“十四五”圆满收官。,2025-12-11 14:32:16,https://finance.eastmoney.com/a/202512113588788997.html
日韩股市集体收跌,【日韩股市集体收跌】日经225指数收跌0.90%，报50148.82点；韩国KOSPI指数收跌0.66%，报4107.77点。,2025-12-11 14:31:51,https://finance.eastmoney.com/a/202512113588792426.html
新产季“车厘子快线”载鲜果陆续抵达,【新产季“车厘子快线”载鲜果陆续抵达】近日，一艘装载369柜、超7800吨智利车厘子的“车厘子快线”货船靠泊广州南沙港二期码头。这是2025至2026年南半球车厘子新产季以来，广州南沙口岸迎来的首批海运直航进口车厘子，也是新产季全国首批海运直航进口车厘子。,2025-12-11 14:30:34,https://finance.eastmoney.com/a/202512113588787651.html
茂业商业午后触及涨停上演“地天”板,茂业商业午后触及涨停上演“地天”板，成交额近12亿元。,2025-12-11 14:30:03,https://finance.eastmoney.com/a/202512113588787454.html
火了！4A级景区急招“野人”：日薪200元 朝九晚五 上班不能说人话只能“嗷嗷叫” 喜欢上蹿下跳者优先！,【火了！4A级景区急招“野人”：日薪200元 朝九晚五 上班不能说人话只能“嗷嗷叫” 喜欢上蹿下跳者优先！】“急招‘野人’，200元/天，不能说人话，只能嗷嗷，需要烤苞谷、烤红苕、烤洋芋，喜欢上蹿下跳的优先录取。”还有人担心这个招聘的真实性，当地文旅局和景区相关工作人员向记者证实，招聘是真的，“目前已收到数百条报名私信，许多网友发布自荐视频参与应聘，都回复不过来了。”,2025-12-11 14:27:11,https://finance.eastmoney.com/a/202512113588785543.html
又炒火一只妖股！继“咆哮小猫”后 美股有了新“带头大哥”,【又炒火一只妖股！继“咆哮小猫”后 美股有了新“带头大哥”】从Opendoor到Nextdoor，今年一些最疯狂的美国散户，似乎找到了自己的赚钱之“门”(door)；而在背后推动这两只网红妖股飙升的对冲基金EMJCapital创始人EricJackson，似乎也当仁不让地成为了美国散户们的新“带头大哥”……,2025-12-11 14:26:27,https://finance.eastmoney.com/a/202512113588783127.html
零售概念探底回升 百大集团涨停,零售概念探底回升，百大集团涨停，永辉超市涨超6%，中百集团、步步高、茂业商业跟涨。,2025-12-11 14:25:30,https://finance.eastmoney.com/a/202512113588782735.html
韩国拟放松银企分离规则 以刺激投资,【韩国拟放松银企分离规则 以刺激投资】韩国财政部长具润哲周四表示，韩国计划放宽银行和商业分离的规定，以刺激投资，尽管民间团体担心此举只会让大型家族企业集团受益。根据修订后的规则，大型控股公司可能被允许对金融部门拥有一定的控制权，以便为前沿技术提供融资。,2025-12-11 14:24:00,https://finance.eastmoney.com/a/202512113588780384.html
极越汽车发布致债权人通知 未登记、维护车辆应立即停止使用,【极越汽车发布致债权人通知 未登记、维护车辆应立即停止使用】据极越汽车微信公众号消息，近日，极越汽车临时管理人发布致全体债权人的通知称，鉴于目前公司存在车辆及实验设备流散在外的情况，并且市场上存在伪造资料为车辆办理注册登记、拆解零部件销售、将车辆转移至境外或通过其他方式违规上牌等违法风险，临时管理人特此作出多项提示。,2025-12-11 14:19:15,https://finance.eastmoney.com/a/202512113588775786.html
利尔化学：全球农药市场库存逐步回归正常水平 部分产品价格出现止跌回升迹象,【利尔化学：全球农药市场库存逐步回归正常水平 部分产品价格出现止跌回升迹象】利尔化学(002258)在机构调研中表示，目前农药行业总体依旧竞争激烈，主要大宗农药产品价格仍在底部盘整，但全球农药市场库存逐步回归正常水平，部分产品的市场需求回暖、价格也出现止跌回升的迹象，给行业发展带来了一定积极影响。,2025-12-11 14:17:31,https://finance.eastmoney.com/a/202512113588773239.html
“特朗普金卡”签证开始接受申请 费用收入用于给美国政府还债,【“特朗普金卡”签证开始接受申请 费用收入用于给美国政府还债】据央视新闻报道，美国总统特朗普在美东时间12月10日宣布，美国政府当天起正式接受“特朗普金卡”签证计划的申请，以鼓励全球富人移居美国并获得居留许可。,2025-12-11 14:15:21,https://finance.eastmoney.com/a/202512113588774832.html
沪深两市成交额连续第100个交易日突破1.5万亿 较昨日此时放量超300亿,沪深两市成交额连续第100个交易日突破1.5万亿，较昨日此时放量超300亿。,2025-12-11 14:14:14,https://finance.eastmoney.com/a/202512113588771134.html
中泰国际李迅雷：破局之道在于供需再平衡与服务业突破,【中泰国际李迅雷：破局之道在于供需再平衡与服务业突破】李迅雷特别强调，虽然房地产市场经历了调整，但高科技发展和AI进步为经济带来了新的增长点。“我们有高科技的发展，有AI的影响，可以找到新的亮点，带来结构性机会。”李迅雷表示，“这正是‘十五五’规划强调科技创新的原因所在。”,2025-12-11 14:14:11,https://finance.eastmoney.com/a/202512113588771489.html
国内首个全自主无人化人形机器人导览方案发布 多机协同赋能多元场景,【国内首个全自主无人化人形机器人导览方案发布 多机协同赋能多元场景】12月11日，北京人形机器人创新中心正式发布国内首个全自主无人化人形机器人导览解决方案，以“慧思开物”通用具身智能平台为核心支撑，整合多项关键能力，为人形机器人在导览导购场景的规模化落地筑牢基础。,2025-12-11 14:13:15,https://finance.eastmoney.com/a/202512113588769755.html
三大迹象抬高美联储降息门槛 机构激辩未来政策走向,【三大迹象抬高美联储降息门槛 机构激辩未来政策走向】在通胀压力坚挺和就业市场疲软的夹击中，美联储选择继续降息。最新发布的利率点阵图中值显示，美联储2026年仅会降息一次，这一立场明显比市场预期的大约55个基点（或略多于两次降息）的宽松幅度更为鹰派。分析称，会议投票结果、美联储主席鲍威尔表态、通胀数据等三大迹象均暗示美联储进一步降息的门槛高于市场预期。,2025-12-11 14:12:42,https://finance.eastmoney.com/a/202512113588771037.html
香港金融管理局余伟文：美国未来利率走向仍存在不确定性,【香港金融管理局余伟文：美国未来利率走向仍存在不确定性】关于美联储最新利率决议，香港金融管理局总裁余伟文12月11日发表观点称，美联储自2024年9月开启降息周期以来已经降息175基点。会后发表的点阵图显示，美联储有可能于2026年内再降息25基点，但通胀走势和就业市场情况仍存在较大不确定性，因而未来的货币政策走向有待观察。,2025-12-11 14:11:10,https://finance.eastmoney.com/a/202512113588768586.html
四川为电梯安全立法 破解“量大面广”的监管痛点,【四川为电梯安全立法 破解“量大面广”的监管痛点】《四川省电梯安全条例》将于明年5月1日起正式施行，聚焦电梯维护保养、既有住宅加装电梯、电梯智慧监管等核心立法诉求，进一步完善了电梯生产经营、使用管理、维护保养、检验检测等全生命周期的管理规定，标志着四川电梯安全管理进入法治化、规范化的新阶段。,2025-12-11 14:09:17,https://finance.eastmoney.com/a/202512113588767872.html
摩尔线程涨超22% 股价突破900元关口 市值超4200亿,摩尔线程涨超22%，股价突破900元关口，成交额102亿，市值超4230亿。,2025-12-11 14:08:23,https://finance.eastmoney.com/a/202512113588768275.html
天壕能源与IndoSino公司签署战略合作协议,【天壕能源与IndoSino公司签署战略合作协议】据天壕能源消息，近日，天壕能源通过旗下天壕香港平台，与PT Indo Sino Oil dan Gas（简称“IndoSino公司”）成功签署战略合作协议。双方将在能源领域开展多维度、深层次的协同合作，共同挖掘区域能源产业的巨大潜力，助力区域能源产业的转型升级与可持续发展。公司表示，此次战略合作协议的签署，标志着公司正式跻身印尼能源市场。,2025-12-11 14:07:37,https://finance.eastmoney.com/a/202512113588765975.html
告别“拆迁暴富” 第一批危房如何应对“老年危机”,【告别“拆迁暴富” 第一批危房如何应对“老年危机”】不同于过往的“拆迁暴富”，如今一种新的更新模式正悄然铺开——自主更新、原拆原建，即从“政府主导”转向“群众自主”，把原有老旧房屋彻底拆除，原址重新修建一栋房屋，并大多由居民出资、政府补贴、多元筹集。告别拆迁暴富、政府主导，当居民成为小区改造的主人，会面临哪些现实挑战？,2025-12-11 14:06:43,https://finance.eastmoney.com/a/202512113588769620.html
机构：预计2026年Q1 Mobile eMMC/UFS涨幅将达25%~30%,【机构：预计2026年Q1 Mobile eMMC/UFS涨幅将达25%~30%】CFM闪存市场近日发布2026年存储市场展望报告。报告指出，预计2026一季度，Mobile eMMC/UFS涨幅将达25%~30%，LPDDR4X/5X涨幅或达30%~35%；PC端DDR5/LPDDR5X涨幅将达30%~35%，cSSD上涨25%~30%。,2025-12-11 14:06:26,https://finance.eastmoney.com/a/202512113588765377.html
烽火通信空芯光纤取得0.063dB/km超低衰减新突破,【烽火通信空芯光纤取得0.063dB/km超低衰减新突破】近日，烽火通信自主研发的空芯反谐振光纤性能取得新突破，依托升级的精密控制平台和改进型双嵌套结构，通过截断法测试1550nm波段的最低衰减值达0.063dB/km，跻身国际先进水平。,2025-12-11 14:05:02,https://finance.eastmoney.com/a/202512113588765625.html
国联人寿增资至46.6亿 增幅约122%,【国联人寿增资至46.6亿 增幅约122%】天眼查App显示，近日，国联人寿保险股份有限公司发生工商变更，注册资本由21亿人民币增至约46.6亿人民币，增幅约122%，同时，法定代表人及多位高管发生变更。该公司成立于2014年12月，法定代表人为钱芳，经营范围为人寿保险和年金保险，健康保险，意外伤害保险，分红型保险，万能型保险，上述业务的再保险业务，国家法律、法规允许的保险资金运用业务，经中国保监会批准的其他业务。,2025-12-11 14:03:04,https://finance.eastmoney.com/a/202512113588763514.html
亚翔集成涨停创历史新高 或受益于半导体设备出货额大幅增长,【亚翔集成涨停创历史新高 或受益于半导体设备出货额大幅增长】12月11日下午，亚翔集成涨停，报81.08元/股，股价创历史新高。亚翔集成属于装修装饰行业，为IC半导体等高科技电子产业的建厂工程提供洁净室工程、工艺二次配工程及建筑工程等服务，包括洁净厂房建造规划、设计建议、设备配置、洁净室环境系统集成、生产机台二次配管工程及维护服务等。,2025-12-11 14:03:00,https://finance.eastmoney.com/a/202512113588763244.html
货基、ETF申赎登记结算费2026年起由15万/年降至12万元/年,【货基、ETF申赎登记结算费2026年起由15万/年降至12万元/年】记者了解到，中国结算发布通知称，为降低市场参与成本，自2026年1月1日起减免三类登记结算业务收费：其中货币基金、ETF的申购、赎回登记结算费由15万元/年下调为12万元/年。,2025-12-11 14:02:33,https://finance.eastmoney.com/a/202512113588762879.html
前11个月我国汽车产销量双超3100万辆,【前11个月我国汽车产销量双超3100万辆】11月份，我国汽车月度产量首次超过350万辆，创历史新高。不仅如此，今年前11个月，汽车产销量均超过3100万辆，同比增长均超过10%。,2025-12-11 14:01:00,https://finance.eastmoney.com/a/202512113588762537.html
中国互联网金融协会：供应链金融业务合规整改仍是首要任务 绝不能“带病”盲目扩张发展,【中国互联网金融协会：供应链金融业务合规整改仍是首要任务 绝不能“带病”盲目扩张发展】中国互联网金融协会秘书长马超表示，协会按照《通知》要求积极推进自律管理各项工作，目前基本实现对账款凭证主要从业机构的自律管理触达，初步建立业务统计监测机制，基本摸清市场底数，持续宣贯先规范再发展的指导思想，助推凭证期限合理控制、融资成本持续下行，引导弱小平台有序退出，及时处理相关风险事件。,2025-12-11 13:59:12,https://finance.eastmoney.com/a/202512113588761631.html
走进人形机器人生产工厂 探秘机器人的“出生”过程,【走进人形机器人生产工厂 探秘机器人的“出生”过程】站得住、走得稳、跑得快，随着人形机器人应用场景越来越多元、技术越来越精进、协作越来越顺畅，它们正加速走进我们的生产生活。在智元机器人位于上海的量产工厂内，数百台机器人正在等待发货。,2025-12-11 13:58:45,https://finance.eastmoney.com/a/202512113588761413.html
中泰国际首席经济学家李迅雷：2026年货币政策总量宽松幅度有限,【中泰国际首席经济学家李迅雷：2026年货币政策总量宽松幅度有限】在中泰证券举办的年度策略会上，中泰国际首席经济学家李迅雷表示，2026年货币政策总量宽松空间受限，降息面临低息差、资金空转入市等约束，其稳市场信号意义强于经济刺激，预计7天逆回购利率下调10-20bp；当前加权存款准备金率已降至6.2%，接近5%的隐性下限，央行流动性投放工具已趋完善，预计全年降准1-2次。,2025-12-11 13:57:46,https://finance.eastmoney.com/a/202512113588760856.html
思特威推出5000万像素0.64μm手机应用CMOS图像传感器,【思特威推出5000万像素0.64μm手机应用CMOS图像传感器】近日，思特威推出5000万像素0.64μm像素尺寸手机应用CMOS图像传感器SC512HS，具备高动态范围、低噪声、快速对焦等多项性能优势，是思特威国产高性能Stacked BSI平台系列化的又一拓展新品，兼顾性能与成本优势，可适用于主流智能手机主摄及中高端手机辅摄等多类型摄像头。,2025-12-11 13:56:54,https://finance.eastmoney.com/a/202512113588759666.html
电解液价格翻倍 股东却频频减持 是理性套现还是看空信号？,【电解液价格翻倍 股东却频频减持 是理性套现还是看空信号？】近期，电解液上市公司频繁公布股东减持计划。记者不完全统计，11月底以来，已有包括华盛锂电(688353.SH)、天际股份(002759.SZ)、海科新能(301292.SZ)、天赐材料(002709.SZ)和多氟多(002407.SZ)在内的多家电解液行业上市公司的股东、高管等计划减持。,2025-12-11 13:56:04,https://finance.eastmoney.com/a/202512113588759311.html
摩尔线程盘中涨超20%,A股摩尔线程盘中涨超20%，现报887元。,2025-12-11 13:53:40,https://finance.eastmoney.com/a/202512113588756431.html
机构：元旦假期国内多个热门城市酒店预订量同比增长超3倍,【机构：元旦假期国内多个热门城市酒店预订量同比增长超3倍】12月11日，去哪儿旅行大数据显示，2026年1月1日—3日元旦假期期间，国内多个热门城市酒店订单量同比增3倍以上。除了北上赏雪、南下避寒的经典选择，游客迎接新年的出行方式愈发多元，在音乐、乐园、山水中，解锁了迎接新年的N种仪式感。,2025-12-11 13:53:23,https://finance.eastmoney.com/a/202512113588757150.html
手握3200亿现金 宁德时代计划最高发100亿债券！机构预期明年盈利940亿,【手握3200亿现金 宁德时代计划最高发100亿债券！机构预期明年盈利940亿】时代财经注意到，宁德时代本次发行的债券期限不超过5年，具体发行期限将根据公司实际资金需求和发行时市场情况等最终确定，可以是单一期限品种，也可以是多种期限品种的组合。这意味着，宁德时代的百亿债券可能有着不同的组合设计，且公司已明确会根据公司实际资金需求以及市场环境在注册额度和有效期内可一次或分次择机发行。,2025-12-11 13:47:44,https://finance.eastmoney.com/a/202512113588754040.html
教育部：2024年留学回国49.5万人 同比增长19.1%,【教育部：2024年留学回国49.5万人 同比增长19.1%】记者11日从教育部获悉，2024年留学回国49.5万人，较2023年增加7.94万人，同比增长19.1%，人才回流呈加速态势。,2025-12-11 13:47:23,https://finance.eastmoney.com/a/202512113588753123.html
日本一客机因引擎停转紧急着陆,【日本一客机因引擎停转紧急着陆】今天（12月11日），日本北海道航空系统公司一架ATR42客机在从札幌丘珠机场起飞后，在穿越云层时单侧引擎停止运转，随后在北海道函馆机场紧急着陆。,2025-12-11 13:47:16,https://finance.eastmoney.com/a/202512113588754321.html
喜茶门店一年降超六百家？知情人士：年初叫停加盟，退出“内卷”,【喜茶门店一年降超六百家？知情人士：年初叫停加盟，退出“内卷”】12月11日，记者自接近喜茶的人士获悉：“喜茶自2024年年底已经确定要调整门店发展方向，收缩规模便是具体举措之一。在喜茶看来，当前，我国新茶饮行业门店总体规模处于过剩状态，喜茶在今年年初主动叫停加盟，就是想要退出这种规模‘内卷游戏’。喜茶当前的发展重心不在门店扩张，而是聚焦在产品本身。”,2025-12-11 13:46:36,https://finance.eastmoney.com/a/202512113588753935.html
荣昌生物盘中一度涨超7% RC148治疗数据在ESMO-IO大会公布,【荣昌生物盘中一度涨超7% RC148治疗数据在ESMO-IO大会公布】12月11日，荣昌生物盘中一度涨超7%，最高价报82.85港元/股。截至13时13分，该股涨幅回落至1.42%，报78.3港元/股。据悉，今年8月，RC148已获FDA批准在美国开展II期临床试验。,2025-12-11 13:43:39,https://finance.eastmoney.com/a/202512113588752047.html
胜宏科技成交额达100亿元,胜宏科技成交额达100亿元，现涨0.54%。,2025-12-11 13:40:55,https://finance.eastmoney.com/a/202512113588751043.html
华懋科技入股集成电路封装研发商中科智芯,【华懋科技入股集成电路封装研发商中科智芯】企查查APP显示，近日，江苏中科智芯集成科技有限公司发生工商变更，新增华懋科技为股东。企查查信息显示，该公司成立于2018年，经营范围包含：集成电路、半导体器件技术研发；半导体分立器件制造；半导体集成电路和系统集成产品的研发、生产与销售等。据其官网，中科智芯致力于集成电路封装及测试、设计、制造与技术服务。,2025-12-11 13:40:26,https://finance.eastmoney.com/a/202512113588750470.html
韩国寻求在明年上半年设立主权财富基金,【韩国寻求在明年上半年设立主权财富基金】韩国财政部长具润哲在向总统李在明汇报政策时称，韩国将寻求在明年上半年设立韩式主权财富基金。具润哲表示，财政部将积极管理政府债券，调整短期和长期国债的发行组合，并调整国债、公共债券和担保债券的发行时机。计划明年实现GDP增速至少1.8%；将于1月制定增长战略。,2025-12-11 13:40:09,https://finance.eastmoney.com/a/202512113588751433.html
中国30年期国债期货上涨0.5%,中国30年期国债期货上涨0.5%，10年期国债期货涨0.12%。,2025-12-11 13:39:54,https://finance.eastmoney.com/a/202512113588750360.html
空客集团到访苏州工业园区 与智达诚远等企业就AI+航空展开深度对接,【空客集团到访苏州工业园区 与智达诚远等企业就AI+航空展开深度对接】12月10日，空客集团（AirBus）高层访华团到达苏州工业园区，与协会会员单位智达诚远、思必驰、九识智能、星逻智能等本土AI企业展开深度对接。此次访苏，空客带着对AI技术赋能航空产业的迫切需求，聚焦智能交互、智能座舱、低空经济、数字化服务等核心赛道，寻求与中国AI创新企业的战略协同。,2025-12-11 13:38:46,https://finance.eastmoney.com/a/202512113588749666.html
