标题,摘要,发布时间,链接
俄总理：俄商品出口正更多面向欧亚经济联盟、独联体、金砖国家、上合组织等市场,【俄总理：俄商品出口正更多面向欧亚经济联盟、独联体、金砖国家、上合组织等市场】俄罗斯总理米舒斯京10月21日表示，尽管面临来自不友好国家的外部压力，但根据俄经济发展部的数据，俄罗斯制造的商品仍有市场，俄愿意进行坦诚对话和互利贸易。,2025-10-22 08:21:26,https://finance.eastmoney.com/a/202510223540514596.html
厄瓜多尔发生6.0级地震,【厄瓜多尔发生6.0级地震】总台记者当地时间21日获悉，厄瓜多尔发生6.0级地震。,2025-10-22 08:20:03,https://finance.eastmoney.com/a/202510223540513931.html
纳芯微港股IPO获中国证监会备案,"【纳芯微港股IPO获中国证监会备案】纳芯微提交了在香港联交所发行不超过40,976,900股普通股的上市申请，并已获得中国证监会备案。该公司是一家fabless公司，提供高性能、高可靠性的模拟芯片解决方案，连接真实世界与数字世界。根据弗若斯特沙利文的数据，按2024年模拟芯片收入计算，纳芯微在中国模拟芯片市场中位列中国厂商第五名。",2025-10-22 08:18:09,https://finance.eastmoney.com/a/202510223540514237.html
中信证券：资源国主动干预供给有望为关键矿产带来持续的供给约束及战略溢价,【中信证券：资源国主动干预供给有望为关键矿产带来持续的供给约束及战略溢价】中信证券指出，近年来，全球资源民族主义浪潮渐起，资源国主动干预供给有望为关键矿产带来持续的供给约束及战略溢价。从矿产品种来看，小金属资源稀缺叠加供给集中度高，或更易受政策约束。,2025-10-22 08:17:00,https://finance.eastmoney.com/a/202510223540513764.html
软银集团股价一度跌超8% 为2020年8月以来的最大跌幅,软银集团股价一度跌超8%，为2020年8月以来的最大跌幅。,2025-10-22 08:15:04,https://finance.eastmoney.com/a/202510223540513538.html
“DNA花朵”微型机器人可自适应环境变化,【“DNA花朵”微型机器人可自适应环境变化】美国北卡罗来纳大学研究团队研发出一种名为“DNA花朵”的微型机器人。这种机器人具有独特的自适应环境变化能力，能够像生物体一样，根据周围环境改变形状和行为。“DNA花朵”机器人由DNA与无机材料结合形成的特殊晶体构成，能在几秒内迅速折叠与展开，是迄今为止开发出的最具动态性的微型材料之一。,2025-10-22 08:14:17,https://finance.eastmoney.com/a/202510223540512872.html
舒噻胺或成首款治疗睡眠呼吸暂停药物,【舒噻胺或成首款治疗睡眠呼吸暂停药物】据最新一期《柳叶刀》杂志报道，一种名为“舒噻胺”的碳酸酐酶抑制剂类药物，可显著减少阻塞性睡眠呼吸暂停患者的呼吸暂停次数，从而提高他们的睡眠质量。这项由瑞典哥德堡大学参与的临床研究，为无法耐受呼吸机面罩的患者带来了新的治疗希望。研究人员表示，若未来在更大规模临床试验中证实安全有效，舒噻胺或将成为第一种治疗睡眠呼吸暂停的药物。,2025-10-22 08:13:01,https://finance.eastmoney.com/a/202510223540512391.html
俄工贸部长：与俄友好国家间采用本币结算比例显著提升,【俄工贸部长：与俄友好国家间采用本币结算比例显著提升】俄罗斯工业和贸易部长阿里哈诺夫在“俄罗斯制造”国际出口论坛期间接受采访时表示，俄罗斯与友好国家间贸易以卢布和友好国家货币结算的份额显著提升。,2025-10-22 08:11:09,https://finance.eastmoney.com/a/202510223540511739.html
中信证券：保持景气赛道配置的同时 逐步加大对宏观相对敏感的传统行业的配置,【中信证券：保持景气赛道配置的同时 逐步加大对宏观相对敏感的传统行业的配置】中信证券认为，居民收入信心虽继续回落，预期指数上升；就业情绪有所波动；通胀预期小幅走强；各线级城市房价信心均有下挫；A股投资方面，多数居民乐于维持配置而非加仓，黄金热度随着金价上涨而攀升。维持投资观点，建议保持景气赛道配置的同时，逐步加大对宏观相对敏感的传统行业的配置。,2025-10-22 08:10:41,https://finance.eastmoney.com/a/202510223540511375.html
AI“重编程”癌症干细胞促其自毁,【AI“重编程”癌症干细胞促其自毁】美国加州大学圣迭戈分校研究团队开发了一种摧毁癌症干细胞的新方法，该方法在结肠癌的研究中取得了突破。他们利用人工智能精准识别治疗靶点，并通过“重编程”癌症干细胞促使其自我毁灭。这种方法仅针对癌细胞，不影响周围组织，有望成为比现有治疗方法更安全、更精确的替代方案。相关成果20日发表在《细胞·报告医学》期刊上。,2025-10-22 08:09:39,https://finance.eastmoney.com/a/202510223540511277.html
中信证券：量子信息落地加速 政策有望持续支持,【中信证券：量子信息落地加速 政策有望持续支持】中信证券研报指出，2025年诺贝尔物理学奖表彰量子计算的工程化应用，预示着量子信息商业化竞赛将进入新的加速阶段。海外市场在技术路线上呈现分化，量子通信、测量商业化加速。国内前沿科研验证领先，应用场景驱动场景落地。以“祖冲之三号”为代表的科研成果保持世界领先，同时国盾量子等企业在产业化应用、核心硬件取得关键进展。,2025-10-22 08:07:42,https://finance.eastmoney.com/a/202510223540510986.html
现货黄金日内跌幅扩大至2%,现货黄金日内跌幅扩大至2%，现报4043.02美元/盎司。,2025-10-22 08:06:55,https://finance.eastmoney.com/a/202510223540510825.html
从“感光”迈向“识形” 视网膜下微芯片助黄斑变性失明患者恢复视力,【从“感光”迈向“识形” 视网膜下微芯片助黄斑变性失明患者恢复视力】由美国斯坦福医学院、英国莫菲尔德眼科医院、德国波恩大学等多家国际科研机构组成的团队，开发出一款视网膜下无线微芯片，结合一副高科技眼镜，首次真正提供“形式视觉”，成功帮助晚期老年性黄斑变性患者恢复了视力。在一项临床试验中，32名完成一年随访的参与者中有27人恢复了阅读能力。这项研究成果20日发表在《新英格兰医学杂志》上。,2025-10-22 08:06:01,https://finance.eastmoney.com/a/202510223540510554.html
现货黄金失守4060美元/盎司 日内跌1.59%,现货黄金失守4060美元/盎司，日内跌1.59%。,2025-10-22 08:03:51,https://finance.eastmoney.com/a/202510223540510273.html
信达生物：与武田制药达成全球战略合作 交易总金额最高可达114亿美元,【信达生物：与武田制药达成全球战略合作 交易总金额最高可达114亿美元】信达生物早间在港交所公告，于2025年10月22日（香港时间），信达生物与武田制药达成全球战略合作，旨在加速推进信达生物新一代IO及ADC疗法开发。本次合作包括两款后期在研疗法IBI363及IBI343，以及一款早期研发项目IBI3001的选择权。,2025-10-22 08:01:43,https://finance.eastmoney.com/a/202510223540508762.html
2026年AI向物理世界挺进,【2026年AI向物理世界挺进】2025年已成为人工智能（AI）全面融入人类日常生活的一年。无论是工作、娱乐、学习还是科研，AI的影响力已无处不在。美国《福布斯》杂志近日报道预测，2026年，AI所带来的长远影响将日益清晰，并持续为人类创造新的可能：从推动医疗与教育水平提升，到助力科学发现，再到以多种方式优化日常事务、提升生活品质。,2025-10-22 08:00:14,https://finance.eastmoney.com/a/202510223540508637.html
乐聚机器人完成15亿元Pre-IPO轮融资 IPO计划推进中,【乐聚机器人完成15亿元Pre-IPO轮融资 IPO计划推进中】记者获悉，乐聚机器人于近日完成Pre-IPO轮融资，金额规模15亿元，由深投控资本、深圳龙华资本、前海基础投资、石景山产业基金、东方精工、拓普集团、中信金石、中证投资、道禾长期投资、盛奕资本、联新资本、探针创投、合肥产投、玖兆投资及中美绿色基金等多家机构联合投资。另据知情人士，目前乐聚已完成股改，IPO计划正在推进中。,2025-10-22 07:58:24,https://finance.eastmoney.com/a/202510223540502044.html
现货黄金在周三早盘再度跌破4100美元/盎司,现货黄金在周三早盘再度跌破4100美元/盎司，日内跌幅扩大至0.6%。,2025-10-22 07:57:05,https://finance.eastmoney.com/a/202510223540491062.html
隆基绿能获上海电力400MW海上光伏订单,【隆基绿能获上海电力400MW海上光伏订单】10月22日，据隆基绿能消息，上海电力股份有限公司奉贤1# 海上光伏项目组件选型日前确定为BC技术路线，隆基绿能签约400MW，已于本月率先启动供货。上海首批1GW（交流侧装机）“风光同场”海上光伏项目指标，分别由上海电力和申能股份各获50%。此前，申能股份的500MW（交流侧装机）项目已由BC产品占据全部份额。至此，上海首批海上光伏项目已开标份额全部采用BC技术路线。,2025-10-22 07:55:49,https://finance.eastmoney.com/a/202510223540483318.html
美联储沃勒：美联储正在研究简化版“支付账户”,【美联储沃勒：美联储正在研究简化版“支付账户”】美联储高级官员周二表示，美联储正在研究创建一种新账户，为目前依赖银行等第三方接入美联储支付服务的公司提供直接接入渠道。,2025-10-22 07:54:02,https://finance.eastmoney.com/a/202510223540470872.html
“极蛙”机器人在北极成功“探冰”,【“极蛙”机器人在北极成功“探冰”】记者21日从中山大学获悉，由我国科研人员自主研发的“极蛙”双运动模式水下机器人，日前在北冰洋科学考察中成功完成冰区下潜任务，为研究北冰洋冰底环境提供了关键技术支撑。,2025-10-22 07:53:29,https://finance.eastmoney.com/a/202510223540466642.html
长八甲火箭YF-75DB氢氧发动机完成鉴定试车,【长八甲火箭YF-75DB氢氧发动机完成鉴定试车】记者21日从中国航天科技集团一院获悉，10月18日，长征八号甲运载火箭YF-75DB氢氧发动机顺利完成鉴定试车。这标志着该型发动机正式进入工程应用阶段。,2025-10-22 07:52:03,https://finance.eastmoney.com/a/202510223540456528.html
飞天电商售价跌破1700元？普五跌破800元？茅台、五粮液喊话：正规渠道购酒,【飞天电商售价跌破1700元？普五跌破800元？茅台、五粮液喊话：正规渠道购酒】“双11”大促来临之际，茅台、五粮液等多家白酒企业“喊话”消费者，要选择正规渠道购酒。酒类分析师蔡学飞对记者表示，在目前行业整体承压情况下，头部酒企在“双11”前集体规范渠道，是其面对当前市场疲软、线上价格混乱以及假货频出等挑战，为维护品牌价值、稳定价盘所采取的一次主动且必要的防御性举措。,2025-10-22 07:51:39,https://finance.eastmoney.com/a/202510223540471067.html
暂缓与普京会晤 特朗普对俄乌和谈态度再变,【暂缓与普京会晤 特朗普对俄乌和谈态度再变】美国总统特朗普21日称，他与俄罗斯总统普京原定的会面计划被搁置，因为他不想“浪费”这次会面。同一天，法国总统府发布一份多名欧洲领导人关于乌克兰问题的联合声明，称“强烈支持”特朗普在乌克兰问题上的立场，将加大对俄罗斯施压、持续支持乌克兰。,2025-10-22 07:49:48,https://finance.eastmoney.com/a/202510223540445837.html
固态电池产业资本开支大增 相关板块投资价值逐步显现,【固态电池产业资本开支大增 相关板块投资价值逐步显现】媒体报道，固态电池无疑是今年以来科技成长板块最受关注的板块之一，政策端和需求端多方发力，实际落地预期已提前至2026年左右。产业资本开支大增。以wind固态电池指数成分为研究对象，梳理2025年中报，记者发现，53家A股相关上市公司中，只有33家公司归母净利润为正，不过，有44家上市公司固定投资扩张率正增长，30家研发费用同比增长。,2025-10-22 07:46:48,https://finance.eastmoney.com/a/202510223540509887.html
广东发文推进核心软件攻关 工业软件有望迎来发展新机遇,【广东发文推进核心软件攻关 工业软件有望迎来发展新机遇】广东省人民政府办公厅印发《广东省人工智能赋能制造业高质量发展行动方案（2025—2027年）》，文件提出推进核心软件攻关等工程，实施一批技术攻关项目，推动人工智能赋能重点工业软件迭代升级。推动人工智能与工业互联网协同赋能，支持企业建设融合人工智能的跨行业跨领域和特色专业型工业互联网平台，发展模型即服务、智能供给插件等创新模式。,2025-10-22 07:46:47,https://finance.eastmoney.com/a/202510223540509573.html
光厂商竞相布局的新战场 机构称OCS未来增长确定性强,【光厂商竞相布局的新战场 机构称OCS未来增长确定性强】机构指出，光学电路交换（OCS）技术通过光域直接交换实现低延迟、低功耗的网络重构，已成为光厂商竞相布局的新战场，并与光模块形成互补共生的生态体系。,2025-10-22 07:46:45,https://finance.eastmoney.com/a/202510223540509483.html
投资日历：周三资本市场大事提醒,【投资日历：周三资本市场大事提醒】①今日共有1只新股申购，为北交所的丹娜生物（920009）；1只新股上市，为深主板的马可波罗（001386）。②华为终端：将于10月22日14:30发布鸿蒙操作系统6。③2025年（第七届）中国固态电池技术创新与产业化研讨会将于10月22日至24日举办。,2025-10-22 07:45:25,https://finance.eastmoney.com/a/202510223540426586.html
中信建投：三季报行情开启 维持机器人成长主线推荐,【中信建投：三季报行情开启 维持机器人成长主线推荐】中信建投研报称，人形机器人板块当前已回吐9月累计涨幅，中信建投认为产业趋势0—1兑现的拐点前夕，当前基本面正常推进，短期调整或主要因为关税加征预期下，科技成长主线走弱，前期板块获利资金了结；10月至今处于Optimus三代样机发布及订单落地前的真空期，特斯拉10月23日三季报及11月7日股东大会成为重要观测窗口期。当前因流动性波动导致的回调是买点，三季报业绩及机器人业务进展超预期的个股成配置首选。,2025-10-22 07:44:33,https://finance.eastmoney.com/a/202510223540426372.html
网警重拳出击 斩断“查档”侵公、AI生成假户籍证明黑色产业链,【网警重拳出击 斩断“查档”侵公、AI生成假户籍证明黑色产业链】近日，福建泉州公安网安部门在“净网-2025”专项工作中成功侦破一起非法“查档”并开具虚假证明材料的新型网络黑灰产案件，一举抓获犯罪嫌疑人5名，现场查获一批公民个人信息及虚假户籍证明材料。斩断一条集非法获取、买卖公民个人信息和伪造、变造国家机关公文、印章的黑色产业链条，有力维护了人民群众个人信息安全。,2025-10-22 07:43:28,https://finance.eastmoney.com/a/202510223540426278.html
中指研究院：9月重点城市二手房交易活跃度明显回升,【中指研究院：9月重点城市二手房交易活跃度明显回升】中指研究院数据监测：2025年9月百城二手住宅均价为13381元/平方米，环比下跌0.74%，同比下跌7.38%，9月重点城市二手房交易活跃度明显回升，但高挂牌量背景下，价格持续面临一定下行压力。截至9月，百城二手房价格已连续41个月环比下跌。三季度，百城二手房价格累计下跌2.26%，跌幅较二季度扩大0.14个百分点。前三季度百城二手房价格累计下跌5.79%。,2025-10-22 07:42:24,https://finance.eastmoney.com/a/202510223540424165.html
中信建投：伴随算力需求提升与第三代半导体发展 未来金刚石在高端散热市场空间广阔,【中信建投：伴随算力需求提升与第三代半导体发展 未来金刚石在高端散热市场空间广阔】中信建投研报称，随着半导体产业更先进制程迈进，芯片尺寸缩小而功率激增，“热点”问题突出，芯片表面温度过高会导致安全性和可靠性下降，催生对高效散热方案的需求。金刚石是理想散热材料，热导率可达2000W/mK，是铜、银的4—5倍，也是硅、碳化硅等半导体材料的数倍至数十倍，且兼具高带隙、极高电流承载能力、优异机械强度与抗辐射性，在高功率密度、高温高压等严苛场景中优势显著。,2025-10-22 07:40:46,https://finance.eastmoney.com/a/202510223540415458.html
疯狂！大牛股一夜暴涨超162%！发生了什么？,【疯狂！大牛股一夜暴涨超162%！发生了什么？】隔夜美股市场，“人造肉第一股”Beyond Meat股价大幅飙涨，盘中一度暴涨超162%，三个交易日暴涨近600%。美股盘后，该股股价再度暴涨超24%。消息面上，Beyond Meat宣布与沃尔玛达成协议，将在全美更多门店扩大分销范围。,2025-10-22 07:39:02,https://finance.eastmoney.com/a/202510223540410771.html
股价大跌超8%！泡泡玛特最新业绩来了 有何亮点？,【股价大跌超8%！泡泡玛特最新业绩来了 有何亮点？】10月21日盘后，潮玩巨头泡泡玛特（09992.HK）在港交所披露2025年第三季度业务数据。数据显示，泡泡玛特在第三季度实现同比245%—250%的整体收益增长。其中中国市场收益同比增长185%—190%；海外数据尤为亮眼，美洲市场同比增幅超12倍，欧洲地区同比增长超7倍。,2025-10-22 07:38:57,https://finance.eastmoney.com/a/202510223540404915.html
财说| IPO募资资金大量闲置却仍要“圈钱” 新莱福并购有何蹊跷？,【财说| IPO募资资金大量闲置却仍要“圈钱” 新莱福并购有何蹊跷？】新莱福（301323.SZ）正计划以发行股份及支付现金方式收购实控人汪小明控制的广州金南磁性材料有限公司100%股权，交易总价10.54亿元，并募集配套资金。界面新闻记者发现，这场看似常规的产业并购，背后暗藏关联交易纠葛、资金使用效率低下、标的资产盈利波动、财务数据存疑等多重争议。,2025-10-22 07:37:50,https://finance.eastmoney.com/a/202510223540407413.html
生物医药产业：创新引擎强劲 竞逐全球市场,【生物医药产业：创新引擎强劲 竞逐全球市场】短短两天，国产创新药物就开出了5张出海大单，其中多个交易总金额超10亿美元。前沿领域、创新靶点、国际大单，中国生物医药产业的创新实力不仅获得国际认可，也得到跨国大药企的信任与垂青。“十四五”期间，国产创新药获批上市数量稳步上升，出海交易屡爆大单，完成了从“量的积累”到“质的飞跃”的深刻蝶变。,2025-10-22 07:37:27,https://finance.eastmoney.com/a/202510223540395055.html
长城汽车公布新款坦克400预售价：30.98万起,【长城汽车公布新款坦克400预售价：30.98万起】10月21日晚间，长城汽车宣布，新款坦克400正式预售，预售价格30.98万元起。,2025-10-22 07:36:42,https://finance.eastmoney.com/a/202510223540384732.html
韩称朝鲜向半岛东部方向发射导弹 朝方暂无回应,【韩称朝鲜向半岛东部方向发射导弹 朝方暂无回应】当地时间22日，韩国联合参谋本部称，朝鲜向半岛东部方向发射不明弹道导弹。目前，朝鲜方面暂无回应。,2025-10-22 07:35:10,https://finance.eastmoney.com/a/202510223540376232.html
上汽大众与Neura Robotics将在汽车制造领域开发部署认知机器人系统,【上汽大众与Neura Robotics将在汽车制造领域开发部署认知机器人系统】据上汽大众消息，10月16日，上汽大众与德国机器人公司Neura Robotics签署战略合作谅解备忘录，双方将联合开展探索性项目，在汽车制造领域开发并部署认知机器人系统。此次合作聚焦智能工厂的核心应用场景，重点探索总装任务、质量控制和检测，以及零件到生产线交付的智能厂内物流等领域的技术创新与落地。,2025-10-22 07:33:57,https://finance.eastmoney.com/a/202510223540366638.html
Meta与Blue Owl Capital成立合资企业 将共同开展270亿美元美国数据中心项目,【Meta与Blue Owl Capital成立合资企业 将共同开展270亿美元美国数据中心项目】当地时间10月21日，Meta宣布与Blue Owl Capital管理的基金成立合资企业，分别持股20%和80%，共同开发美国路易斯安那州Hyperion数据中心园区。,2025-10-22 07:33:15,https://finance.eastmoney.com/a/202510223540362524.html
阿迪达斯上调全年业绩指引 营业利润预计将升至20亿欧元,【阿迪达斯上调全年业绩指引 营业利润预计将升至20亿欧元】当地时间10月21日，阿迪达斯发布2025年第三季度初步业绩报告：剔除汇率影响，阿迪达斯品牌营收同比增长12%；尽管面临不利汇率波动和关税上涨影响，公司毛利率仍提升0.5个百分点至51.8%；营业利润升至7.36亿欧元，上年同期为5.98亿欧元，营业利润率达到11.1%。,2025-10-22 07:31:51,https://finance.eastmoney.com/a/202510223540354918.html
宠物巨头忙跨界 依依股份入股瑞派宠物医院,【宠物巨头忙跨界 依依股份入股瑞派宠物医院】宠物卫生用品巨头依依股份近期动作频频。自10月13日官宣并购杭州高爷家有好多猫宠物食品有限责任公司之后，10月16日，依依股份又宣布与北京方圆金鼎投资管理有限公司共同投资共青城金谈创业投资合伙企业。,2025-10-22 07:23:36,https://finance.eastmoney.com/a/202510223540335510.html
“退房”棋局落定！珠海免税拟转让格力房产100%股权 | 速读公告,【“退房”棋局落定！珠海免税拟转让格力房产100%股权 | 速读公告】围绕退出房地产业务的重组自去年启动以来，珠免集团（600185.SH）相关资产置换动作频频。珠免集团于10月21日晚间披露公告，拟将持有的珠海格力房产有限公司（简称“格力房产”）100%股权转让至珠海投捷控股有限公司（简称“投捷控股”），交易采用现金方式，不涉及发行股份。,2025-10-22 07:23:18,https://finance.eastmoney.com/a/202510223540334675.html
沃尔玛据悉暂停向需要H-1B签证的候选人发放录用通知,"【沃尔玛据悉暂停向需要H-1B签证的候选人发放录用通知】据报道，知情人士透露，沃尔玛已暂停向需要H-1B签证的候选人发出录用通知。该政策主要影响沃尔玛公司总部员工。特朗普政府上个月宣布对新的H-1B签证申请征收10万美元费用，在科技及其他依赖大量外籍专业人才的行业引发连锁反应。根据政府数据，沃尔玛是美国大型零售连锁中使用H-1B签证人数最多的企业，约雇有2,390名H-1B持有人。",2025-10-22 07:21:08,https://finance.eastmoney.com/a/202510223540333412.html
商业航天企业密集闯关资本市场 机构预测业绩高增长的相关概念股出炉,【商业航天企业密集闯关资本市场 机构预测业绩高增长的相关概念股出炉】近年来，我国商业航天产业迎来前所未有的发展契机，正从技术探索迈向规模化、市场化、资本化的新阶段。随着政策红利持续释放、核心技术不断突破，多家头部企业陆续启动上市辅导，标志着商业航天正式进入资本市场的“聚光灯”下，产业整体迈入发展快车道。与此同时，资本市场热情高涨，相关概念股获机构密集关注，一场围绕“星辰大海”的投资浪潮正悄然兴起。,2025-10-22 07:17:36,https://finance.eastmoney.com/a/202510223540331811.html
专家研判今年秋冬或形成一次弱拉尼娜事件,【专家研判今年秋冬或形成一次弱拉尼娜事件】根据近期海洋和大气监测情况，国家海洋环境预报中心预测，今年冬季，我国渤海、东海南部海温预计略偏高0.5℃到1℃，黄海、东海中部与北部海温预计偏高1℃到2℃，南海大部海温接近常年平均水平。专家还表示，根据监测，今年秋冬季赤道中东太平洋将处于中性偏冷状态，可能形成一次弱拉尼娜事件。,2025-10-22 07:15:14,https://finance.eastmoney.com/a/202510223540331343.html
